number,value,datetime_start,datetime_complete,duration,params_criterion,params_max_depth,params_max_features,params_min_samples_leaf,params_min_samples_split,params_n_estimators,system_attrs_fixed_params,system_attrs_tpe:relative_params:0,state
0,0.23690717394969946,2026-09-19 17:06:12.774068,2026-09-19 17:06:24.738391,0 days 00:00:11.964323,entropy,13,sqrt,10,44,844,"{'n_estimators': 844, 'max_depth': 13, 'min_samples_split': 44, 'min_samples_leaf': 10, 'max_features': 'sqrt', 'criterion': 'entropy'}",,COMPLETE
1,0.21553543411916073,2026-09-19 17:06:24.738391,2026-09-19 17:06:36.868430,0 days 00:00:12.130039,gini,24,0.5,12,37,437,,,COMPLETE
2,0.21382156754048168,2026-09-19 17:06:36.868430,2026-09-19 17:06:55.390220,0 days 00:00:18.521790,gini,22,0.25,4,12,973,,,COMPLETE
3,0.21273218012186507,2026-09-19 17:06:55.390220,2026-09-19 17:07:08.699119,0 days 00:00:13.308899,gini,11,0.75,16,24,363,,,COMPLETE
4,0.23596618354752472,2026-09-19 17:07:08.699119,2026-09-19 17:07:20.727876,0 days 00:00:12.028757,entropy,25,log2,7,41,954,,,COMPLETE
5,0.22521518468578905,2026-09-19 17:07:20.727876,2026-09-19 17:07:26.778319,0 days 00:00:06.050443,gini,18,0.25,11,17,333,,,COMPLETE
6,0.2034589126502918,2026-09-19 17:07:26.778319,2026-09-19 17:07:31.425139,0 days 00:00:04.646820,entropy,5,0.5,1,11,930,,,PRUNED
7,0.2169016159322762,2026-09-19 17:07:31.426645,2026-09-19 17:07:32.946176,0 days 00:00:01.519531,entropy,21,0.5,20,5,226,,,PRUNED
8,0.21672935864900117,2026-09-19 17:07:32.946176,2026-09-19 17:07:33.555760,0 days 00:00:00.609584,gini,11,sqrt,18,7,166,,,PRUNED
9,0.2270485858316828,2026-09-19 17:07:33.555760,2026-09-19 17:07:48.359046,0 days 00:00:14.803286,gini,13,0.25,15,7,899,,,COMPLETE
10,0.23201516935450162,2026-09-19 17:07:48.359046,2026-09-19 17:08:01.427901,0 days 00:00:13.068855,entropy,10,sqrt,9,25,989,,"{""criterion"": ""entropy"", ""max_depth"": 10, ""max_features"": ""sqrt"", ""min_samples_leaf"": 9, ""min_samples_split"": 25, ""n_estimators"": 989}",COMPLETE
11,0.2349284274688535,2026-09-19 17:08:01.427901,2026-09-19 17:08:09.103142,0 days 00:00:07.675241,entropy,23,log2,8,36,592,,"{""criterion"": ""entropy"", ""max_depth"": 23, ""max_features"": ""log2"", ""min_samples_leaf"": 8, ""min_samples_split"": 36, ""n_estimators"": 592}",COMPLETE
12,0.23341115872789517,2026-09-19 17:08:09.103142,2026-09-19 17:08:19.266504,0 days 00:00:10.163362,entropy,17,log2,2,40,733,,"{""criterion"": ""entropy"", ""max_depth"": 17, ""max_features"": ""log2"", ""min_samples_leaf"": 2, ""min_samples_split"": 40, ""n_estimators"": 733}",COMPLETE
13,0.22297851118748332,2026-09-19 17:08:19.266504,2026-09-19 17:08:21.182754,0 days 00:00:01.916250,entropy,9,log2,9,38,770,,"{""criterion"": ""entropy"", ""max_depth"": 9, ""max_features"": ""log2"", ""min_samples_leaf"": 9, ""min_samples_split"": 38, ""n_estimators"": 770}",PRUNED
14,0.22099900601697922,2026-09-19 17:08:21.182754,2026-09-19 17:08:23.171997,0 days 00:00:01.989243,entropy,9,sqrt,11,50,774,,"{""criterion"": ""entropy"", ""max_depth"": 9, ""max_features"": ""sqrt"", ""min_samples_leaf"": 11, ""min_samples_split"": 50, ""n_estimators"": 774}",PRUNED
15,0.2247447548540365,2026-09-19 17:08:23.171997,2026-09-19 17:08:26.796309,0 days 00:00:03.624312,entropy,19,0.25,12,44,904,,"{""criterion"": ""entropy"", ""max_depth"": 19, ""max_features"": 0.25, ""min_samples_leaf"": 12, ""min_samples_split"": 44, ""n_estimators"": 904}",PRUNED
16,0.22177629366500637,2026-09-19 17:08:26.796309,2026-09-19 17:08:29.188130,0 days 00:00:02.391821,entropy,25,sqrt,7,47,916,,"{""criterion"": ""entropy"", ""max_depth"": 25, ""max_features"": ""sqrt"", ""min_samples_leaf"": 7, ""min_samples_split"": 47, ""n_estimators"": 916}",PRUNED
17,0.23681255545708316,2026-09-19 17:08:29.188130,2026-09-19 17:08:36.345202,0 days 00:00:07.157072,entropy,14,sqrt,14,44,548,,"{""criterion"": ""entropy"", ""max_depth"": 14, ""max_features"": ""sqrt"", ""min_samples_leaf"": 14, ""min_samples_split"": 44, ""n_estimators"": 548}",COMPLETE
18,0.2347040625992666,2026-09-19 17:08:36.345202,2026-09-19 17:08:42.018453,0 days 00:00:05.673251,entropy,13,sqrt,15,50,368,,"{""criterion"": ""entropy"", ""max_depth"": 13, ""max_features"": ""sqrt"", ""min_samples_leaf"": 15, ""min_samples_split"": 50, ""n_estimators"": 368}",COMPLETE
19,0.23341381103436737,2026-09-19 17:08:42.018453,2026-09-19 17:08:51.293481,0 days 00:00:09.275028,entropy,13,sqrt,9,36,677,,"{""criterion"": ""entropy"", ""max_depth"": 13, ""max_features"": ""sqrt"", ""min_samples_leaf"": 9, ""min_samples_split"": 36, ""n_estimators"": 677}",COMPLETE
20,0.22180953224865013,2026-09-19 17:08:51.293481,2026-09-19 17:08:53.075299,0 days 00:00:01.781818,entropy,14,sqrt,15,45,652,,"{""criterion"": ""entropy"", ""max_depth"": 14, ""max_features"": ""sqrt"", ""min_samples_leaf"": 15, ""min_samples_split"": 45, ""n_estimators"": 652}",PRUNED
21,0.21116120744031008,2026-09-19 17:08:53.075299,2026-09-19 17:08:58.067800,0 days 00:00:04.992501,entropy,6,0.5,11,40,947,,"{""criterion"": ""entropy"", ""max_depth"": 6, ""max_features"": 0.5, ""min_samples_leaf"": 11, ""min_samples_split"": 40, ""n_estimators"": 947}",PRUNED
22,0.2253109398192652,2026-09-19 17:08:58.067800,2026-09-19 17:08:59.334872,0 days 00:00:01.267072,entropy,17,sqrt,15,37,454,,"{""criterion"": ""entropy"", ""max_depth"": 17, ""max_features"": ""sqrt"", ""min_samples_leaf"": 15, ""min_samples_split"": 37, ""n_estimators"": 454}",PRUNED
23,0.23334417485202213,2026-09-19 17:08:59.334872,2026-09-19 17:09:08.786413,0 days 00:00:09.451541,entropy,24,sqrt,15,39,687,,"{""criterion"": ""entropy"", ""max_depth"": 24, ""max_features"": ""sqrt"", ""min_samples_leaf"": 15, ""min_samples_split"": 39, ""n_estimators"": 687}",COMPLETE
24,0.2232752451922143,2026-09-19 17:09:08.786413,2026-09-19 17:09:09.885151,0 days 00:00:01.098738,entropy,14,sqrt,11,41,355,,"{""criterion"": ""entropy"", ""max_depth"": 14, ""max_features"": ""sqrt"", ""min_samples_leaf"": 11, ""min_samples_split"": 41, ""n_estimators"": 355}",PRUNED
25,0.21025632644588285,2026-09-19 17:09:09.885151,2026-09-19 17:09:18.371316,0 days 00:00:08.486165,entropy,15,0.75,9,39,845,,"{""criterion"": ""entropy"", ""max_depth"": 15, ""max_features"": 0.75, ""min_samples_leaf"": 9, ""min_samples_split"": 39, ""n_estimators"": 845}",PRUNED
26,0.23782361224058848,2026-09-19 17:09:18.371316,2026-09-19 17:09:26.172170,0 days 00:00:07.800854,entropy,20,sqrt,10,44,552,,"{""criterion"": ""entropy"", ""max_depth"": 20, ""max_features"": ""sqrt"", ""min_samples_leaf"": 10, ""min_samples_split"": 44, ""n_estimators"": 552}",COMPLETE
27,0.2232254072416231,2026-09-19 17:09:26.172170,2026-09-19 17:09:28.867405,0 days 00:00:02.695235,entropy,18,0.25,10,42,628,,"{""criterion"": ""entropy"", ""max_depth"": 18, ""max_features"": 0.25, ""min_samples_leaf"": 10, ""min_samples_split"": 42, ""n_estimators"": 628}",PRUNED
28,0.2215409299859643,2026-09-19 17:09:28.867405,2026-09-19 17:09:29.955041,0 days 00:00:01.087636,entropy,19,sqrt,12,43,376,,"{""criterion"": ""entropy"", ""max_depth"": 19, ""max_features"": ""sqrt"", ""min_samples_leaf"": 12, ""min_samples_split"": 43, ""n_estimators"": 376}",PRUNED
29,0.21956572234586977,2026-09-19 17:09:29.955041,2026-09-19 17:09:31.184742,0 days 00:00:01.229701,entropy,11,sqrt,10,34,475,,"{""criterion"": ""entropy"", ""max_depth"": 11, ""max_features"": ""sqrt"", ""min_samples_leaf"": 10, ""min_samples_split"": 34, ""n_estimators"": 475}",PRUNED
