number,value,datetime_start,datetime_complete,duration,params_criterion,params_max_depth,params_max_features,params_min_samples_leaf,params_min_samples_split,params_n_estimators,system_attrs_fixed_params,system_attrs_tpe:relative_params:0,state
0,0.25317391491865726,2026-09-19 17:00:28.798012,2026-09-19 17:00:36.144207,0 days 00:00:07.346195,entropy,3,log2,2,17,713,"{'n_estimators': 713, 'max_depth': 3, 'min_samples_split': 17, 'min_samples_leaf': 2, 'max_features': 'log2', 'criterion': 'entropy'}",,COMPLETE
1,0.22971501462378335,2026-09-19 17:00:36.144207,2026-09-19 17:00:47.853709,0 days 00:00:11.709502,gini,24,0.5,12,37,437,,,COMPLETE
2,0.22642117014079663,2026-09-19 17:00:47.853709,2026-09-19 17:01:06.614873,0 days 00:00:18.761164,gini,22,0.25,4,12,973,,,COMPLETE
3,0.2214790149399783,2026-09-19 17:01:06.614873,2026-09-19 17:01:19.528662,0 days 00:00:12.913789,gini,11,0.75,16,24,363,,,COMPLETE
4,0.24739206787206341,2026-09-19 17:01:19.528662,2026-09-19 17:01:31.368744,0 days 00:00:11.840082,entropy,25,log2,7,41,954,,,COMPLETE
5,0.1845708511948012,2026-09-19 17:01:31.368744,2026-09-19 17:01:32.647620,0 days 00:00:01.278876,gini,18,0.25,11,17,333,,,PRUNED
6,0.17499949860047126,2026-09-19 17:01:32.647620,2026-09-19 17:01:37.259246,0 days 00:00:04.611626,entropy,5,0.5,1,11,930,,,PRUNED
7,0.23472136588899337,2026-09-19 17:01:37.259246,2026-09-19 17:01:44.724066,0 days 00:00:07.464820,entropy,21,0.5,20,5,226,,,COMPLETE
8,0.1835557739502306,2026-09-19 17:01:44.724066,2026-09-19 17:01:45.332279,0 days 00:00:00.608213,gini,11,sqrt,18,7,166,,,PRUNED
9,0.24050026629229265,2026-09-19 17:01:45.332279,2026-09-19 17:01:59.832451,0 days 00:00:14.500172,gini,13,0.25,15,7,899,,,COMPLETE
10,0.25329965108119323,2026-09-19 17:01:59.832451,2026-09-19 17:02:03.794901,0 days 00:00:03.962450,entropy,3,log2,10,39,404,,"{""criterion"": ""entropy"", ""max_depth"": 3, ""max_features"": ""log2"", ""min_samples_leaf"": 10, ""min_samples_split"": 39, ""n_estimators"": 404}",COMPLETE
11,0.18221132015264724,2026-09-19 17:02:03.794901,2026-09-19 17:02:04.899223,0 days 00:00:01.104322,entropy,6,log2,6,5,502,,"{""criterion"": ""entropy"", ""max_depth"": 6, ""max_features"": ""log2"", ""min_samples_leaf"": 6, ""min_samples_split"": 5, ""n_estimators"": 502}",PRUNED
12,0.1843533345951909,2026-09-19 17:02:04.899223,2026-09-19 17:02:05.599584,0 days 00:00:00.700361,entropy,6,log2,3,35,318,,"{""criterion"": ""entropy"", ""max_depth"": 6, ""max_features"": ""log2"", ""min_samples_leaf"": 3, ""min_samples_split"": 35, ""n_estimators"": 318}",PRUNED
13,0.2540996275485493,2026-09-19 17:02:05.599584,2026-09-19 17:02:09.590709,0 days 00:00:03.991125,entropy,3,log2,12,33,366,,"{""criterion"": ""entropy"", ""max_depth"": 3, ""max_features"": ""log2"", ""min_samples_leaf"": 12, ""min_samples_split"": 33, ""n_estimators"": 366}",COMPLETE
14,0.2537126989620479,2026-09-19 17:02:09.590709,2026-09-19 17:02:13.115184,0 days 00:00:03.524475,entropy,4,log2,13,38,348,,"{""criterion"": ""entropy"", ""max_depth"": 4, ""max_features"": ""log2"", ""min_samples_leaf"": 13, ""min_samples_split"": 38, ""n_estimators"": 348}",COMPLETE
15,0.18626776652432894,2026-09-19 17:02:13.115184,2026-09-19 17:02:14.055885,0 days 00:00:00.940701,entropy,7,log2,14,25,372,,"{""criterion"": ""entropy"", ""max_depth"": 7, ""max_features"": ""log2"", ""min_samples_leaf"": 14, ""min_samples_split"": 25, ""n_estimators"": 372}",PRUNED
16,0.2476978614174729,2026-09-19 17:02:14.055885,2026-09-19 17:02:16.567743,0 days 00:00:02.511858,entropy,7,log2,17,27,588,,"{""criterion"": ""entropy"", ""max_depth"": 7, ""max_features"": ""log2"", ""min_samples_leaf"": 17, ""min_samples_split"": 27, ""n_estimators"": 588}",PRUNED
17,0.18728628012570156,2026-09-19 17:02:16.567743,2026-09-19 17:02:17.475645,0 days 00:00:00.907902,entropy,4,log2,20,48,306,,"{""criterion"": ""entropy"", ""max_depth"": 4, ""max_features"": ""log2"", ""min_samples_leaf"": 20, ""min_samples_split"": 48, ""n_estimators"": 306}",PRUNED
18,0.25381084570213863,2026-09-19 17:02:17.475645,2026-09-19 17:02:20.656237,0 days 00:00:03.180592,entropy,7,log2,15,50,255,,"{""criterion"": ""entropy"", ""max_depth"": 7, ""max_features"": ""log2"", ""min_samples_leaf"": 15, ""min_samples_split"": 50, ""n_estimators"": 255}",COMPLETE
19,0.17786232019225962,2026-09-19 17:02:20.656237,2026-09-19 17:02:21.334745,0 days 00:00:00.678508,entropy,12,log2,15,39,199,,"{""criterion"": ""entropy"", ""max_depth"": 12, ""max_features"": ""log2"", ""min_samples_leaf"": 15, ""min_samples_split"": 39, ""n_estimators"": 199}",PRUNED
20,0.18861752612415952,2026-09-19 17:02:21.334745,2026-09-19 17:02:22.108518,0 days 00:00:00.773773,entropy,6,sqrt,15,49,258,,"{""criterion"": ""entropy"", ""max_depth"": 6, ""max_features"": ""sqrt"", ""min_samples_leaf"": 15, ""min_samples_split"": 49, ""n_estimators"": 258}",PRUNED
21,0.18538541169427275,2026-09-19 17:02:22.108518,2026-09-19 17:02:23.118045,0 days 00:00:01.009527,entropy,9,log2,14,47,411,,"{""criterion"": ""entropy"", ""max_depth"": 9, ""max_features"": ""log2"", ""min_samples_leaf"": 14, ""min_samples_split"": 47, ""n_estimators"": 411}",PRUNED
22,0.18687945738106784,2026-09-19 17:02:23.118045,2026-09-19 17:02:23.564681,0 days 00:00:00.446636,entropy,3,sqrt,14,31,136,,"{""criterion"": ""entropy"", ""max_depth"": 3, ""max_features"": ""sqrt"", ""min_samples_leaf"": 14, ""min_samples_split"": 31, ""n_estimators"": 136}",PRUNED
23,0.18674582851388555,2026-09-19 17:02:23.564681,2026-09-19 17:02:24.220948,0 days 00:00:00.656267,entropy,9,sqrt,11,46,251,,"{""criterion"": ""entropy"", ""max_depth"": 9, ""max_features"": ""sqrt"", ""min_samples_leaf"": 11, ""min_samples_split"": 46, ""n_estimators"": 251}",PRUNED
24,0.18665827742495858,2026-09-19 17:02:24.220948,2026-09-19 17:02:24.957511,0 days 00:00:00.736563,entropy,7,log2,14,38,346,,"{""criterion"": ""entropy"", ""max_depth"": 7, ""max_features"": ""log2"", ""min_samples_leaf"": 14, ""min_samples_split"": 38, ""n_estimators"": 346}",PRUNED
25,0.25122275924662996,2026-09-19 17:02:24.957511,2026-09-19 17:02:26.428810,0 days 00:00:01.471299,entropy,3,log2,13,32,312,,"{""criterion"": ""entropy"", ""max_depth"": 3, ""max_features"": ""log2"", ""min_samples_leaf"": 13, ""min_samples_split"": 32, ""n_estimators"": 312}",PRUNED
26,0.2529954418852364,2026-09-19 17:02:26.428810,2026-09-19 17:02:27.455477,0 days 00:00:01.026667,entropy,4,log2,19,21,256,,"{""criterion"": ""entropy"", ""max_depth"": 4, ""max_features"": ""log2"", ""min_samples_leaf"": 19, ""min_samples_split"": 21, ""n_estimators"": 256}",PRUNED
27,0.18206637879629622,2026-09-19 17:02:27.455477,2026-09-19 17:02:28.246517,0 days 00:00:00.791040,entropy,4,0.25,17,41,286,,"{""criterion"": ""entropy"", ""max_depth"": 4, ""max_features"": 0.25, ""min_samples_leaf"": 17, ""min_samples_split"": 41, ""n_estimators"": 286}",PRUNED
28,0.18403682058086612,2026-09-19 17:02:28.246517,2026-09-19 17:02:29.590344,0 days 00:00:01.343827,entropy,13,log2,10,27,506,,"{""criterion"": ""entropy"", ""max_depth"": 13, ""max_features"": ""log2"", ""min_samples_leaf"": 10, ""min_samples_split"": 27, ""n_estimators"": 506}",PRUNED
29,0.24961025000530665,2026-09-19 17:02:29.590344,2026-09-19 17:02:31.944443,0 days 00:00:02.354099,entropy,5,log2,14,43,541,,"{""criterion"": ""entropy"", ""max_depth"": 5, ""max_features"": ""log2"", ""min_samples_leaf"": 14, ""min_samples_split"": 43, ""n_estimators"": 541}",PRUNED
