number,value,datetime_start,datetime_complete,duration,params_criterion,params_max_depth,params_max_features,params_min_samples_leaf,params_min_samples_split,params_n_estimators,system_attrs_fixed_params,system_attrs_tpe:relative_params:0,state
0,0.19751255723162792,2026-09-19 19:20:09.978465,2026-09-19 19:20:42.468101,0 days 00:00:32.489636,entropy,24,log2,3,42,885,"{'n_estimators': 885, 'max_depth': 24, 'min_samples_split': 42, 'min_samples_leaf': 3, 'max_features': 'log2', 'criterion': 'entropy'}",,COMPLETE
1,0.20738557675330652,2026-09-19 19:20:42.468101,2026-09-19 19:21:26.982920,0 days 00:00:44.514819,gini,24,0.5,12,37,437,,,COMPLETE
2,0.20713685606910884,2026-09-19 19:21:26.982920,2026-09-19 19:22:28.716284,0 days 00:01:01.733364,gini,22,0.25,4,12,973,,,COMPLETE
3,0.20914806782693085,2026-09-19 19:22:28.716284,2026-09-19 19:23:16.440970,0 days 00:00:47.724686,gini,11,0.75,16,24,363,,,COMPLETE
4,0.20167408325843791,2026-09-19 19:23:16.440970,2026-09-19 19:23:50.148321,0 days 00:00:33.707351,entropy,25,log2,7,41,954,,,COMPLETE
5,0.2058086148792814,2026-09-19 19:23:50.148321,2026-09-19 19:24:09.047918,0 days 00:00:18.899597,gini,18,0.25,11,17,333,,,COMPLETE
6,0.19407192379560292,2026-09-19 19:24:09.047918,2026-09-19 19:25:13.714355,0 days 00:01:04.666437,entropy,5,0.5,1,11,930,,,PRUNED
7,0.20816346152827608,2026-09-19 19:25:13.714355,2026-09-19 19:25:43.746967,0 days 00:00:30.032612,entropy,21,0.5,20,5,226,,,COMPLETE
8,0.17544130987998852,2026-09-19 19:25:43.746967,2026-09-19 19:25:44.692876,0 days 00:00:00.945909,gini,11,sqrt,18,7,166,,,PRUNED
9,0.20694718167699572,2026-09-19 19:25:44.692876,2026-09-19 19:26:32.017727,0 days 00:00:47.324851,gini,13,0.25,15,7,899,,,COMPLETE
10,0.18544080145964192,2026-09-19 19:26:32.017727,2026-09-19 19:26:50.769167,0 days 00:00:18.751440,gini,4,0.75,14,22,330,,"{""criterion"": ""gini"", ""max_depth"": 4, ""max_features"": 0.75, ""min_samples_leaf"": 14, ""min_samples_split"": 22, ""n_estimators"": 330}",PRUNED
11,0.21131741550126265,2026-09-19 19:26:50.769167,2026-09-19 19:27:00.242529,0 days 00:00:09.473362,entropy,23,0.25,19,17,123,,"{""criterion"": ""entropy"", ""max_depth"": 23, ""max_features"": 0.25, ""min_samples_leaf"": 19, ""min_samples_split"": 17, ""n_estimators"": 123}",COMPLETE
12,0.20805453416267708,2026-09-19 19:27:00.242529,2026-09-19 19:27:12.164193,0 days 00:00:11.921664,entropy,22,0.25,20,39,161,,"{""criterion"": ""entropy"", ""max_depth"": 22, ""max_features"": 0.25, ""min_samples_leaf"": 20, ""min_samples_split"": 39, ""n_estimators"": 161}",COMPLETE
13,0.20396370016805948,2026-09-19 19:27:12.164193,2026-09-19 19:27:25.886747,0 days 00:00:13.722554,entropy,8,0.25,18,19,217,,"{""criterion"": ""entropy"", ""max_depth"": 8, ""max_features"": 0.25, ""min_samples_leaf"": 18, ""min_samples_split"": 19, ""n_estimators"": 217}",COMPLETE
14,0.1932363080301375,2026-09-19 19:27:25.886747,2026-09-19 19:27:27.347569,0 days 00:00:01.460822,entropy,24,log2,19,22,233,,"{""criterion"": ""entropy"", ""max_depth"": 24, ""max_features"": ""log2"", ""min_samples_leaf"": 19, ""min_samples_split"": 22, ""n_estimators"": 233}",PRUNED
15,0.19570568629885943,2026-09-19 19:27:27.347569,2026-09-19 19:27:43.242459,0 days 00:00:15.894890,gini,18,0.75,16,31,586,,"{""criterion"": ""gini"", ""max_depth"": 18, ""max_features"": 0.75, ""min_samples_leaf"": 16, ""min_samples_split"": 31, ""n_estimators"": 586}",PRUNED
16,0.19921504292657224,2026-09-19 19:27:43.243460,2026-09-19 19:27:44.264371,0 days 00:00:01.020911,gini,10,sqrt,20,32,194,,"{""criterion"": ""gini"", ""max_depth"": 10, ""max_features"": ""sqrt"", ""min_samples_leaf"": 20, ""min_samples_split"": 32, ""n_estimators"": 194}",PRUNED
17,0.2093675536386425,2026-09-19 19:27:44.264371,2026-09-19 19:28:10.163169,0 days 00:00:25.898798,entropy,24,0.25,16,10,329,,"{""criterion"": ""entropy"", ""max_depth"": 24, ""max_features"": 0.25, ""min_samples_leaf"": 16, ""min_samples_split"": 10, ""n_estimators"": 329}",COMPLETE
18,0.2088330352653151,2026-09-19 19:28:10.163169,2026-09-19 19:28:44.388989,0 days 00:00:34.225820,entropy,16,0.25,18,20,459,,"{""criterion"": ""entropy"", ""max_depth"": 16, ""max_features"": 0.25, ""min_samples_leaf"": 18, ""min_samples_split"": 20, ""n_estimators"": 459}",COMPLETE
19,0.21118451431743707,2026-09-19 19:28:44.388989,2026-09-19 19:29:02.521244,0 days 00:00:18.132255,entropy,23,0.25,15,14,230,,"{""criterion"": ""entropy"", ""max_depth"": 23, ""max_features"": 0.25, ""min_samples_leaf"": 15, ""min_samples_split"": 14, ""n_estimators"": 230}",COMPLETE
20,0.2031321121130138,2026-09-19 19:29:02.521244,2026-09-19 19:29:04.683125,0 days 00:00:02.161881,entropy,23,0.25,10,22,137,,"{""criterion"": ""entropy"", ""max_depth"": 23, ""max_features"": 0.25, ""min_samples_leaf"": 10, ""min_samples_split"": 22, ""n_estimators"": 137}",PRUNED
21,0.20881332987665085,2026-09-19 19:29:04.683125,2026-09-19 19:29:20.611721,0 days 00:00:15.928596,entropy,23,0.25,16,9,205,,"{""criterion"": ""entropy"", ""max_depth"": 23, ""max_features"": 0.25, ""min_samples_leaf"": 16, ""min_samples_split"": 9, ""n_estimators"": 205}",COMPLETE
22,0.20671459098195996,2026-09-19 19:29:20.611721,2026-09-19 19:29:30.739728,0 days 00:00:10.128007,entropy,24,0.25,20,13,131,,"{""criterion"": ""entropy"", ""max_depth"": 24, ""max_features"": 0.25, ""min_samples_leaf"": 20, ""min_samples_split"": 13, ""n_estimators"": 131}",COMPLETE
23,0.2092463369672874,2026-09-19 19:29:30.740719,2026-09-19 19:30:28.128892,0 days 00:00:57.388173,entropy,23,0.5,15,20,410,,"{""criterion"": ""entropy"", ""max_depth"": 23, ""max_features"": 0.5, ""min_samples_leaf"": 15, ""min_samples_split"": 20, ""n_estimators"": 410}",COMPLETE
24,0.20900005752020584,2026-09-19 19:30:28.128892,2026-09-19 19:31:01.829024,0 days 00:00:33.700132,entropy,19,0.25,20,12,451,,"{""criterion"": ""entropy"", ""max_depth"": 19, ""max_features"": 0.25, ""min_samples_leaf"": 20, ""min_samples_split"": 12, ""n_estimators"": 451}",COMPLETE
25,0.20969497279696697,2026-09-19 19:31:01.829024,2026-09-19 19:31:23.044264,0 days 00:00:21.215240,entropy,19,0.25,17,34,277,,"{""criterion"": ""entropy"", ""max_depth"": 19, ""max_features"": 0.25, ""min_samples_leaf"": 17, ""min_samples_split"": 34, ""n_estimators"": 277}",COMPLETE
26,0.20931904740814983,2026-09-19 19:31:23.044264,2026-09-19 19:31:44.082617,0 days 00:00:21.038353,entropy,19,0.25,17,31,273,,"{""criterion"": ""entropy"", ""max_depth"": 19, ""max_features"": 0.25, ""min_samples_leaf"": 17, ""min_samples_split"": 31, ""n_estimators"": 273}",COMPLETE
27,0.20552465855404606,2026-09-19 19:31:44.082617,2026-09-19 19:31:47.882097,0 days 00:00:03.799480,entropy,16,0.25,15,13,250,,"{""criterion"": ""entropy"", ""max_depth"": 16, ""max_features"": 0.25, ""min_samples_leaf"": 15, ""min_samples_split"": 13, ""n_estimators"": 250}",PRUNED
28,0.2114014398899,2026-09-19 19:31:47.882097,2026-09-19 19:32:27.038564,0 days 00:00:39.156467,entropy,18,0.25,15,6,501,,"{""criterion"": ""entropy"", ""max_depth"": 18, ""max_features"": 0.25, ""min_samples_leaf"": 15, ""min_samples_split"": 6, ""n_estimators"": 501}",COMPLETE
29,0.2078013601602882,2026-09-19 19:32:27.038564,2026-09-19 19:32:36.924922,0 days 00:00:09.886358,entropy,21,0.25,12,7,640,,"{""criterion"": ""entropy"", ""max_depth"": 21, ""max_features"": 0.25, ""min_samples_leaf"": 12, ""min_samples_split"": 7, ""n_estimators"": 640}",PRUNED
