number,value,datetime_start,datetime_complete,duration,params_criterion,params_max_depth,params_max_features,params_min_samples_leaf,params_min_samples_split,params_n_estimators,system_attrs_fixed_params,system_attrs_tpe:relative_params:0,state
0,0.22782764593813062,2026-09-19 21:13:41.105304,2026-09-19 21:13:45.204212,0 days 00:00:04.098908,gini,7,log2,2,21,269,"{'n_estimators': 269, 'max_depth': 7, 'min_samples_split': 21, 'min_samples_leaf': 2, 'max_features': 'log2', 'criterion': 'gini'}",,COMPLETE
1,0.23332383892558872,2026-09-19 21:13:45.204212,2026-09-19 21:14:09.526762,0 days 00:00:24.322550,gini,24,0.5,12,37,437,,,COMPLETE
2,0.23186902452589994,2026-09-19 21:14:09.526762,2026-09-19 21:14:42.154386,0 days 00:00:32.627624,gini,22,0.25,4,12,973,,,COMPLETE
3,0.22782730593971684,2026-09-19 21:14:42.154386,2026-09-19 21:15:08.948822,0 days 00:00:26.794436,gini,11,0.75,16,24,363,,,COMPLETE
4,0.26012006494901896,2026-09-19 21:15:08.948822,2026-09-19 21:15:26.034330,0 days 00:00:17.085508,entropy,25,log2,7,41,954,,,COMPLETE
5,0.2415143696459988,2026-09-19 21:15:26.034330,2026-09-19 21:15:36.443470,0 days 00:00:10.409140,gini,18,0.25,11,17,333,,,COMPLETE
6,0.19176319782555085,2026-09-19 21:15:36.443470,2026-09-19 21:15:43.907015,0 days 00:00:07.463545,entropy,5,0.5,1,11,930,,,PRUNED
7,0.20667003927351213,2026-09-19 21:15:43.907015,2026-09-19 21:15:46.754045,0 days 00:00:02.847030,entropy,21,0.5,20,5,226,,,PRUNED
8,0.2574519670123737,2026-09-19 21:15:46.754045,2026-09-19 21:15:49.829718,0 days 00:00:03.075673,gini,11,sqrt,18,7,166,,,COMPLETE
9,0.24745546819553632,2026-09-19 21:15:49.829718,2026-09-19 21:16:16.036787,0 days 00:00:26.207069,gini,13,0.25,15,7,899,,,COMPLETE
10,0.25736784217686226,2026-09-19 21:16:16.036787,2026-09-19 21:16:31.455538,0 days 00:00:15.418751,entropy,18,log2,4,20,788,,"{""criterion"": ""entropy"", ""max_depth"": 18, ""max_features"": ""log2"", ""min_samples_leaf"": 4, ""min_samples_split"": 20, ""n_estimators"": 788}",COMPLETE
11,0.24512746758156972,2026-09-19 21:16:31.456545,2026-09-19 21:16:34.477152,0 days 00:00:03.020607,gini,14,sqrt,11,6,139,,"{""criterion"": ""gini"", ""max_depth"": 14, ""max_features"": ""sqrt"", ""min_samples_leaf"": 11, ""min_samples_split"": 6, ""n_estimators"": 139}",COMPLETE
12,0.25647303317329884,2026-09-19 21:16:34.477152,2026-09-19 21:16:39.132686,0 days 00:00:04.655534,gini,20,sqrt,20,47,244,,"{""criterion"": ""gini"", ""max_depth"": 20, ""max_features"": ""sqrt"", ""min_samples_leaf"": 20, ""min_samples_split"": 47, ""n_estimators"": 244}",COMPLETE
13,0.2508724416946281,2026-09-19 21:16:39.132686,2026-09-19 21:16:50.130093,0 days 00:00:10.997407,gini,8,sqrt,15,27,668,,"{""criterion"": ""gini"", ""max_depth"": 8, ""max_features"": ""sqrt"", ""min_samples_leaf"": 15, ""min_samples_split"": 27, ""n_estimators"": 668}",COMPLETE
14,0.25187684495521506,2026-09-19 21:16:50.130093,2026-09-19 21:17:05.847871,0 days 00:00:15.717778,entropy,24,log2,3,48,850,,"{""criterion"": ""entropy"", ""max_depth"": 24, ""max_features"": ""log2"", ""min_samples_leaf"": 3, ""min_samples_split"": 48, ""n_estimators"": 850}",COMPLETE
15,0.2501910551080324,2026-09-19 21:17:05.847871,2026-09-19 21:17:12.333947,0 days 00:00:06.486076,entropy,19,log2,4,33,319,,"{""criterion"": ""entropy"", ""max_depth"": 19, ""max_features"": ""log2"", ""min_samples_leaf"": 4, ""min_samples_split"": 33, ""n_estimators"": 319}",COMPLETE
16,0.26740797177511355,2026-09-19 21:17:12.333947,2026-09-19 21:17:27.534607,0 days 00:00:15.200660,entropy,17,log2,17,22,862,,"{""criterion"": ""entropy"", ""max_depth"": 17, ""max_features"": ""log2"", ""min_samples_leaf"": 17, ""min_samples_split"": 22, ""n_estimators"": 862}",COMPLETE
17,0.2627225280386787,2026-09-19 21:17:27.534607,2026-09-19 21:17:43.580059,0 days 00:00:16.045452,entropy,15,log2,11,41,887,,"{""criterion"": ""entropy"", ""max_depth"": 15, ""max_features"": ""log2"", ""min_samples_leaf"": 11, ""min_samples_split"": 41, ""n_estimators"": 887}",COMPLETE
18,0.2629219587433846,2026-09-19 21:17:43.581058,2026-09-19 21:17:54.872139,0 days 00:00:11.291081,entropy,14,log2,13,50,667,,"{""criterion"": ""entropy"", ""max_depth"": 14, ""max_features"": ""log2"", ""min_samples_leaf"": 13, ""min_samples_split"": 50, ""n_estimators"": 667}",COMPLETE
19,0.2639787720306443,2026-09-19 21:17:54.873093,2026-09-19 21:18:08.368652,0 days 00:00:13.495559,entropy,17,log2,15,19,740,,"{""criterion"": ""entropy"", ""max_depth"": 17, ""max_features"": ""log2"", ""min_samples_leaf"": 15, ""min_samples_split"": 19, ""n_estimators"": 740}",COMPLETE
20,0.26214056696132115,2026-09-19 21:18:08.369654,2026-09-19 21:18:23.004272,0 days 00:00:14.634618,entropy,16,log2,15,28,783,,"{""criterion"": ""entropy"", ""max_depth"": 16, ""max_features"": ""log2"", ""min_samples_leaf"": 15, ""min_samples_split"": 28, ""n_estimators"": 783}",COMPLETE
21,0.2662484190767952,2026-09-19 21:18:23.004272,2026-09-19 21:18:37.357731,0 days 00:00:14.353459,entropy,15,log2,12,5,776,,"{""criterion"": ""entropy"", ""max_depth"": 15, ""max_features"": ""log2"", ""min_samples_leaf"": 12, ""min_samples_split"": 5, ""n_estimators"": 776}",COMPLETE
22,0.2658650641991557,2026-09-19 21:18:37.357731,2026-09-19 21:18:48.395736,0 days 00:00:11.038005,entropy,20,log2,19,18,629,,"{""criterion"": ""entropy"", ""max_depth"": 20, ""max_features"": ""log2"", ""min_samples_leaf"": 19, ""min_samples_split"": 18, ""n_estimators"": 629}",COMPLETE
23,0.2415141243943988,2026-09-19 21:18:48.395736,2026-09-19 21:18:50.726770,0 days 00:00:02.331034,entropy,20,sqrt,19,12,547,,"{""criterion"": ""entropy"", ""max_depth"": 20, ""max_features"": ""sqrt"", ""min_samples_leaf"": 19, ""min_samples_split"": 12, ""n_estimators"": 547}",PRUNED
24,0.2694017990795611,2026-09-19 21:18:50.726770,2026-09-19 21:19:03.997454,0 days 00:00:13.270684,entropy,14,log2,11,4,727,,"{""criterion"": ""entropy"", ""max_depth"": 14, ""max_features"": ""log2"", ""min_samples_leaf"": 11, ""min_samples_split"": 4, ""n_estimators"": 727}",COMPLETE
25,0.2689356852938853,2026-09-19 21:19:03.997454,2026-09-19 21:19:14.684223,0 days 00:00:10.686769,entropy,11,log2,18,9,641,,"{""criterion"": ""entropy"", ""max_depth"": 11, ""max_features"": ""log2"", ""min_samples_leaf"": 18, ""min_samples_split"": 9, ""n_estimators"": 641}",COMPLETE
26,0.23642399462866684,2026-09-19 21:19:14.684223,2026-09-19 21:19:16.662918,0 days 00:00:01.978695,entropy,10,log2,19,3,591,,"{""criterion"": ""entropy"", ""max_depth"": 10, ""max_features"": ""log2"", ""min_samples_leaf"": 19, ""min_samples_split"": 3, ""n_estimators"": 591}",PRUNED
27,0.26390243588180307,2026-09-19 21:19:16.662918,2026-09-19 21:19:28.301262,0 days 00:00:11.638344,entropy,19,log2,15,3,658,,"{""criterion"": ""entropy"", ""max_depth"": 19, ""max_features"": ""log2"", ""min_samples_leaf"": 15, ""min_samples_split"": 3, ""n_estimators"": 658}",COMPLETE
28,0.2420948129472077,2026-09-19 21:19:28.301262,2026-09-19 21:19:30.426843,0 days 00:00:02.125581,entropy,11,log2,12,21,626,,"{""criterion"": ""entropy"", ""max_depth"": 11, ""max_features"": ""log2"", ""min_samples_leaf"": 12, ""min_samples_split"": 21, ""n_estimators"": 626}",PRUNED
29,0.27012699394354256,2026-09-19 21:19:30.426843,2026-09-19 21:19:46.908474,0 days 00:00:16.481631,entropy,16,log2,13,12,881,,"{""criterion"": ""entropy"", ""max_depth"": 16, ""max_features"": ""log2"", ""min_samples_leaf"": 13, ""min_samples_split"": 12, ""n_estimators"": 881}",COMPLETE
