number,value,datetime_start,datetime_complete,duration,params_criterion,params_max_depth,params_max_features,params_min_samples_leaf,params_min_samples_split,params_n_estimators,system_attrs_tpe:relative_params:0,state
83,0.2694452325599658,2026-09-19 03:34:38.086684,2026-09-19 03:35:04.002017,0 days 00:00:25.915333,gini,18,0.25,11,13,985,"{""criterion"": ""gini"", ""max_depth"": 18, ""max_features"": 0.25, ""min_samples_leaf"": 11, ""min_samples_split"": 13, ""n_estimators"": 985}",COMPLETE
84,0.2691430955387475,2026-09-19 03:35:04.002017,2026-09-19 03:35:26.941059,0 days 00:00:22.939042,gini,18,0.25,9,14,846,"{""criterion"": ""gini"", ""max_depth"": 18, ""max_features"": 0.25, ""min_samples_leaf"": 9, ""min_samples_split"": 14, ""n_estimators"": 846}",COMPLETE
85,0.32220870501014803,2026-09-19 03:35:26.941059,2026-09-19 03:35:32.106730,0 days 00:00:05.165671,gini,18,0.25,8,15,972,"{""criterion"": ""gini"", ""max_depth"": 18, ""max_features"": 0.25, ""min_samples_leaf"": 8, ""min_samples_split"": 15, ""n_estimators"": 972}",PRUNED
86,0.31791652210743954,2026-09-19 03:35:32.106730,2026-09-19 03:35:37.287622,0 days 00:00:05.180892,gini,18,0.25,10,15,983,"{""criterion"": ""gini"", ""max_depth"": 18, ""max_features"": 0.25, ""min_samples_leaf"": 10, ""min_samples_split"": 15, ""n_estimators"": 983}",PRUNED
87,0.3208513463048196,2026-09-19 03:35:37.287622,2026-09-19 03:35:41.828851,0 days 00:00:04.541229,gini,16,0.25,11,14,934,"{""criterion"": ""gini"", ""max_depth"": 16, ""max_features"": 0.25, ""min_samples_leaf"": 11, ""min_samples_split"": 14, ""n_estimators"": 934}",PRUNED
88,0.3154731411087435,2026-09-19 03:35:41.829380,2026-09-19 03:35:45.913031,0 days 00:00:04.083651,gini,18,0.25,12,9,834,"{""criterion"": ""gini"", ""max_depth"": 18, ""max_features"": 0.25, ""min_samples_leaf"": 12, ""min_samples_split"": 9, ""n_estimators"": 834}",PRUNED
89,0.26572277833942576,2026-09-19 03:35:45.913031,2026-09-19 03:36:14.180980,0 days 00:00:28.267949,gini,17,0.25,5,18,986,"{""criterion"": ""gini"", ""max_depth"": 17, ""max_features"": 0.25, ""min_samples_leaf"": 5, ""min_samples_split"": 18, ""n_estimators"": 986}",COMPLETE
90,0.32303586628326625,2026-09-19 03:36:14.180980,2026-09-19 03:36:19.013937,0 days 00:00:04.832957,gini,20,0.25,4,13,790,"{""criterion"": ""gini"", ""max_depth"": 20, ""max_features"": 0.25, ""min_samples_leaf"": 4, ""min_samples_split"": 13, ""n_estimators"": 790}",PRUNED
91,0.3178923457492093,2026-09-19 03:36:19.013937,2026-09-19 03:36:23.290385,0 days 00:00:04.276448,gini,23,0.25,10,11,807,"{""criterion"": ""gini"", ""max_depth"": 23, ""max_features"": 0.25, ""min_samples_leaf"": 10, ""min_samples_split"": 11, ""n_estimators"": 807}",PRUNED
92,0.3243619386515221,2026-09-19 03:36:23.290385,2026-09-19 03:36:28.030371,0 days 00:00:04.739986,gini,18,0.25,6,13,851,"{""criterion"": ""gini"", ""max_depth"": 18, ""max_features"": 0.25, ""min_samples_leaf"": 6, ""min_samples_split"": 13, ""n_estimators"": 851}",PRUNED
93,0.32244869779891927,2026-09-19 03:36:28.030371,2026-09-19 03:36:32.744348,0 days 00:00:04.713977,gini,17,0.25,12,9,980,"{""criterion"": ""gini"", ""max_depth"": 17, ""max_features"": 0.25, ""min_samples_leaf"": 12, ""min_samples_split"": 9, ""n_estimators"": 980}",PRUNED
94,0.2685766038292629,2026-09-19 03:36:32.744348,2026-09-19 03:36:54.194087,0 days 00:00:21.449739,gini,21,0.25,9,7,776,"{""criterion"": ""gini"", ""max_depth"": 21, ""max_features"": 0.25, ""min_samples_leaf"": 9, ""min_samples_split"": 7, ""n_estimators"": 776}",COMPLETE
95,0.30489927673988315,2026-09-19 03:36:54.194087,2026-09-19 03:36:56.433862,0 days 00:00:02.239775,entropy,25,log2,8,43,905,"{""criterion"": ""entropy"", ""max_depth"": 25, ""max_features"": ""log2"", ""min_samples_leaf"": 8, ""min_samples_split"": 43, ""n_estimators"": 905}",PRUNED
96,0.26866087829908497,2026-09-19 03:36:56.433862,2026-09-19 03:37:22.572198,0 days 00:00:26.138336,gini,21,0.25,10,13,968,"{""criterion"": ""gini"", ""max_depth"": 21, ""max_features"": 0.25, ""min_samples_leaf"": 10, ""min_samples_split"": 13, ""n_estimators"": 968}",COMPLETE
97,0.3150974958816105,2026-09-19 03:37:22.573221,2026-09-19 03:37:27.628901,0 days 00:00:05.055680,gini,20,0.25,9,18,950,"{""criterion"": ""gini"", ""max_depth"": 20, ""max_features"": 0.25, ""min_samples_leaf"": 9, ""min_samples_split"": 18, ""n_estimators"": 950}",PRUNED
98,0.2680676431537214,2026-09-19 03:37:27.628901,2026-09-19 03:37:50.557854,0 days 00:00:22.928953,gini,19,0.25,8,16,786,"{""criterion"": ""gini"", ""max_depth"": 19, ""max_features"": 0.25, ""min_samples_leaf"": 8, ""min_samples_split"": 16, ""n_estimators"": 786}",COMPLETE
99,0.32267639697306894,2026-09-19 03:37:50.557854,2026-09-19 03:37:55.754244,0 days 00:00:05.196390,gini,24,0.25,11,13,985,"{""criterion"": ""gini"", ""max_depth"": 24, ""max_features"": 0.25, ""min_samples_leaf"": 11, ""min_samples_split"": 13, ""n_estimators"": 985}",PRUNED
