number,value,datetime_start,datetime_complete,duration,params_criterion,params_max_depth,params_max_features,params_min_samples_leaf,params_min_samples_split,params_n_estimators,system_attrs_tpe:relative_params:0,state
81,0.259105999294778,2026-09-19 04:08:26.680066,2026-09-19 04:08:37.028677,0 days 00:00:10.348611,entropy,11,log2,1,32,751,"{""criterion"": ""entropy"", ""max_depth"": 11, ""max_features"": ""log2"", ""min_samples_leaf"": 1, ""min_samples_split"": 32, ""n_estimators"": 751}",COMPLETE
82,0.28317921518780753,2026-09-19 04:08:37.028677,2026-09-19 04:08:38.491187,0 days 00:00:01.462510,entropy,10,log2,2,34,568,"{""criterion"": ""entropy"", ""max_depth"": 10, ""max_features"": ""log2"", ""min_samples_leaf"": 2, ""min_samples_split"": 34, ""n_estimators"": 568}",PRUNED
83,0.2586308692588552,2026-09-19 04:08:38.491187,2026-09-19 04:08:46.954933,0 days 00:00:08.463746,entropy,9,log2,1,30,652,"{""criterion"": ""entropy"", ""max_depth"": 9, ""max_features"": ""log2"", ""min_samples_leaf"": 1, ""min_samples_split"": 30, ""n_estimators"": 652}",COMPLETE
84,0.28024854367044716,2026-09-19 04:08:46.954933,2026-09-19 04:08:48.910057,0 days 00:00:01.955124,entropy,12,log2,1,49,728,"{""criterion"": ""entropy"", ""max_depth"": 12, ""max_features"": ""log2"", ""min_samples_leaf"": 1, ""min_samples_split"": 49, ""n_estimators"": 728}",PRUNED
85,0.2595747219108664,2026-09-19 04:08:48.910057,2026-09-19 04:09:00.505634,0 days 00:00:11.595577,entropy,11,log2,1,34,828,"{""criterion"": ""entropy"", ""max_depth"": 11, ""max_features"": ""log2"", ""min_samples_leaf"": 1, ""min_samples_split"": 34, ""n_estimators"": 828}",COMPLETE
86,0.25778177315451506,2026-09-19 04:09:00.505634,2026-09-19 04:09:09.880904,0 days 00:00:09.375270,entropy,9,log2,1,32,737,"{""criterion"": ""entropy"", ""max_depth"": 9, ""max_features"": ""log2"", ""min_samples_leaf"": 1, ""min_samples_split"": 32, ""n_estimators"": 737}",COMPLETE
87,0.2563530528788296,2026-09-19 04:09:09.880904,2026-09-19 04:09:20.657572,0 days 00:00:10.776668,entropy,9,log2,2,35,818,"{""criterion"": ""entropy"", ""max_depth"": 9, ""max_features"": ""log2"", ""min_samples_leaf"": 2, ""min_samples_split"": 35, ""n_estimators"": 818}",COMPLETE
88,0.27721984227396285,2026-09-19 04:09:20.657572,2026-09-19 04:09:22.517469,0 days 00:00:01.859897,entropy,10,log2,2,31,716,"{""criterion"": ""entropy"", ""max_depth"": 10, ""max_features"": ""log2"", ""min_samples_leaf"": 2, ""min_samples_split"": 31, ""n_estimators"": 716}",PRUNED
89,0.25857954491553364,2026-09-19 04:09:22.517469,2026-09-19 04:09:34.752951,0 days 00:00:12.235482,entropy,11,log2,1,33,873,"{""criterion"": ""entropy"", ""max_depth"": 11, ""max_features"": ""log2"", ""min_samples_leaf"": 1, ""min_samples_split"": 33, ""n_estimators"": 873}",COMPLETE
90,0.2586024534916321,2026-09-19 04:09:34.752951,2026-09-19 04:09:43.864226,0 days 00:00:09.111275,entropy,11,log2,1,25,641,"{""criterion"": ""entropy"", ""max_depth"": 11, ""max_features"": ""log2"", ""min_samples_leaf"": 1, ""min_samples_split"": 25, ""n_estimators"": 641}",COMPLETE
91,0.2623450960292897,2026-09-19 04:09:43.864226,2026-09-19 04:09:52.962754,0 days 00:00:09.098528,entropy,11,log2,1,23,655,"{""criterion"": ""entropy"", ""max_depth"": 11, ""max_features"": ""log2"", ""min_samples_leaf"": 1, ""min_samples_split"": 23, ""n_estimators"": 655}",COMPLETE
92,0.28382740259341876,2026-09-19 04:09:52.962754,2026-09-19 04:09:55.355383,0 days 00:00:02.392629,entropy,11,log2,1,28,791,"{""criterion"": ""entropy"", ""max_depth"": 11, ""max_features"": ""log2"", ""min_samples_leaf"": 1, ""min_samples_split"": 28, ""n_estimators"": 791}",PRUNED
93,0.25668609180916174,2026-09-19 04:09:55.355383,2026-09-19 04:10:05.016828,0 days 00:00:09.661445,entropy,9,log2,1,20,685,"{""criterion"": ""entropy"", ""max_depth"": 9, ""max_features"": ""log2"", ""min_samples_leaf"": 1, ""min_samples_split"": 20, ""n_estimators"": 685}",COMPLETE
94,0.2879436296761592,2026-09-19 04:10:05.016828,2026-09-19 04:10:06.825648,0 days 00:00:01.808820,entropy,11,log2,1,30,585,"{""criterion"": ""entropy"", ""max_depth"": 11, ""max_features"": ""log2"", ""min_samples_leaf"": 1, ""min_samples_split"": 30, ""n_estimators"": 585}",PRUNED
95,0.2583317973555234,2026-09-19 04:10:06.825648,2026-09-19 04:10:18.427720,0 days 00:00:11.602072,entropy,11,log2,1,33,851,"{""criterion"": ""entropy"", ""max_depth"": 11, ""max_features"": ""log2"", ""min_samples_leaf"": 1, ""min_samples_split"": 33, ""n_estimators"": 851}",COMPLETE
96,0.2827264628567977,2026-09-19 04:10:18.427720,2026-09-19 04:10:20.686872,0 days 00:00:02.259152,entropy,13,log2,2,29,846,"{""criterion"": ""entropy"", ""max_depth"": 13, ""max_features"": ""log2"", ""min_samples_leaf"": 2, ""min_samples_split"": 29, ""n_estimators"": 846}",PRUNED
97,0.2566379496023677,2026-09-19 04:10:20.686872,2026-09-19 04:10:31.119704,0 days 00:00:10.432832,entropy,9,log2,1,29,809,"{""criterion"": ""entropy"", ""max_depth"": 9, ""max_features"": ""log2"", ""min_samples_leaf"": 1, ""min_samples_split"": 29, ""n_estimators"": 809}",COMPLETE
98,0.28369519001571203,2026-09-19 04:10:31.119704,2026-09-19 04:10:33.009135,0 days 00:00:01.889431,entropy,12,log2,1,27,642,"{""criterion"": ""entropy"", ""max_depth"": 12, ""max_features"": ""log2"", ""min_samples_leaf"": 1, ""min_samples_split"": 27, ""n_estimators"": 642}",PRUNED
99,0.2545361283640749,2026-09-19 04:10:33.009135,2026-09-19 04:10:43.186874,0 days 00:00:10.177739,entropy,12,log2,1,32,739,"{""criterion"": ""entropy"", ""max_depth"": 12, ""max_features"": ""log2"", ""min_samples_leaf"": 1, ""min_samples_split"": 32, ""n_estimators"": 739}",COMPLETE
