number,value,datetime_start,datetime_complete,duration,params_criterion,params_max_depth,params_max_features,params_min_samples_leaf,params_min_samples_split,params_n_estimators,system_attrs_tpe:relative_params:0,state
80,0.23231705736284897,2026-09-19 03:58:48.768705,2026-09-19 03:58:53.968069,0 days 00:00:05.199364,entropy,17,sqrt,12,46,873,"{""criterion"": ""entropy"", ""max_depth"": 17, ""max_features"": ""sqrt"", ""min_samples_leaf"": 12, ""min_samples_split"": 46, ""n_estimators"": 873}",PRUNED
81,0.22705642103835885,2026-09-19 03:58:53.968069,2026-09-19 03:58:56.562640,0 days 00:00:02.594571,entropy,19,sqrt,10,43,877,"{""criterion"": ""entropy"", ""max_depth"": 19, ""max_features"": ""sqrt"", ""min_samples_leaf"": 10, ""min_samples_split"": 43, ""n_estimators"": 877}",PRUNED
82,0.22778876146321592,2026-09-19 03:58:56.562640,2026-09-19 03:58:59.297154,0 days 00:00:02.734514,entropy,14,sqrt,11,42,909,"{""criterion"": ""entropy"", ""max_depth"": 14, ""max_features"": ""sqrt"", ""min_samples_leaf"": 11, ""min_samples_split"": 42, ""n_estimators"": 909}",PRUNED
83,0.22884102057146175,2026-09-19 03:58:59.297154,2026-09-19 03:59:01.395790,0 days 00:00:02.098636,entropy,13,sqrt,12,49,737,"{""criterion"": ""entropy"", ""max_depth"": 13, ""max_features"": ""sqrt"", ""min_samples_leaf"": 12, ""min_samples_split"": 49, ""n_estimators"": 737}",PRUNED
84,0.22574943586355742,2026-09-19 03:59:01.395790,2026-09-19 03:59:03.887311,0 days 00:00:02.491521,entropy,25,log2,7,44,957,"{""criterion"": ""entropy"", ""max_depth"": 25, ""max_features"": ""log2"", ""min_samples_leaf"": 7, ""min_samples_split"": 44, ""n_estimators"": 957}",PRUNED
85,0.23644654184502728,2026-09-19 03:59:03.887311,2026-09-19 03:59:12.918513,0 days 00:00:09.031202,entropy,10,sqrt,9,43,766,"{""criterion"": ""entropy"", ""max_depth"": 10, ""max_features"": ""sqrt"", ""min_samples_leaf"": 9, ""min_samples_split"": 43, ""n_estimators"": 766}",PRUNED
86,0.24675487104877808,2026-09-19 03:59:12.918513,2026-09-19 03:59:24.890004,0 days 00:00:11.971491,entropy,21,log2,7,42,916,"{""criterion"": ""entropy"", ""max_depth"": 21, ""max_features"": ""log2"", ""min_samples_leaf"": 7, ""min_samples_split"": 42, ""n_estimators"": 916}",COMPLETE
87,0.22354958368120018,2026-09-19 03:59:24.890004,2026-09-19 03:59:27.066133,0 days 00:00:02.176129,entropy,18,log2,8,44,862,"{""criterion"": ""entropy"", ""max_depth"": 18, ""max_features"": ""log2"", ""min_samples_leaf"": 8, ""min_samples_split"": 44, ""n_estimators"": 862}",PRUNED
88,0.22612964855406056,2026-09-19 03:59:27.066133,2026-09-19 03:59:29.479631,0 days 00:00:02.413498,entropy,23,log2,5,45,832,"{""criterion"": ""entropy"", ""max_depth"": 23, ""max_features"": ""log2"", ""min_samples_leaf"": 5, ""min_samples_split"": 45, ""n_estimators"": 832}",PRUNED
89,0.22797537204504706,2026-09-19 03:59:29.479631,2026-09-19 03:59:32.214078,0 days 00:00:02.734447,entropy,15,sqrt,12,50,970,"{""criterion"": ""entropy"", ""max_depth"": 15, ""max_features"": ""sqrt"", ""min_samples_leaf"": 12, ""min_samples_split"": 50, ""n_estimators"": 970}",PRUNED
90,0.23051335365388495,2026-09-19 03:59:32.214078,2026-09-19 03:59:34.629248,0 days 00:00:02.415170,entropy,17,sqrt,10,44,792,"{""criterion"": ""entropy"", ""max_depth"": 17, ""max_features"": ""sqrt"", ""min_samples_leaf"": 10, ""min_samples_split"": 44, ""n_estimators"": 792}",PRUNED
91,0.22197353519096039,2026-09-19 03:59:34.629248,2026-09-19 03:59:37.276511,0 days 00:00:02.647263,entropy,19,log2,6,43,972,"{""criterion"": ""entropy"", ""max_depth"": 19, ""max_features"": ""log2"", ""min_samples_leaf"": 6, ""min_samples_split"": 43, ""n_estimators"": 972}",PRUNED
92,0.2506534312964154,2026-09-19 03:59:37.276511,2026-09-19 03:59:49.447452,0 days 00:00:12.170941,entropy,13,sqrt,10,44,844,"{""criterion"": ""entropy"", ""max_depth"": 13, ""max_features"": ""sqrt"", ""min_samples_leaf"": 10, ""min_samples_split"": 44, ""n_estimators"": 844}",COMPLETE
93,0.22641118170679927,2026-09-19 03:59:49.447452,2026-09-19 03:59:52.197385,0 days 00:00:02.749933,entropy,12,sqrt,9,41,968,"{""criterion"": ""entropy"", ""max_depth"": 12, ""max_features"": ""sqrt"", ""min_samples_leaf"": 9, ""min_samples_split"": 41, ""n_estimators"": 968}",PRUNED
94,0.2267216510640144,2026-09-19 03:59:52.197385,2026-09-19 03:59:54.812351,0 days 00:00:02.614966,entropy,17,sqrt,9,47,913,"{""criterion"": ""entropy"", ""max_depth"": 17, ""max_features"": ""sqrt"", ""min_samples_leaf"": 9, ""min_samples_split"": 47, ""n_estimators"": 913}",PRUNED
95,0.22491228187108192,2026-09-19 03:59:54.812351,2026-09-19 03:59:57.591163,0 days 00:00:02.778812,entropy,25,log2,8,44,905,"{""criterion"": ""entropy"", ""max_depth"": 25, ""max_features"": ""log2"", ""min_samples_leaf"": 8, ""min_samples_split"": 44, ""n_estimators"": 905}",PRUNED
96,0.2478966106862706,2026-09-19 03:59:57.591163,2026-09-19 04:00:10.360149,0 days 00:00:12.768986,entropy,15,sqrt,10,40,839,"{""criterion"": ""entropy"", ""max_depth"": 15, ""max_features"": ""sqrt"", ""min_samples_leaf"": 10, ""min_samples_split"": 40, ""n_estimators"": 839}",COMPLETE
97,0.2286824932966568,2026-09-19 04:00:10.360149,2026-09-19 04:00:12.992169,0 days 00:00:02.632020,entropy,12,sqrt,11,43,874,"{""criterion"": ""entropy"", ""max_depth"": 12, ""max_features"": ""sqrt"", ""min_samples_leaf"": 11, ""min_samples_split"": 43, ""n_estimators"": 874}",PRUNED
98,0.22613885497133585,2026-09-19 04:00:12.992169,2026-09-19 04:00:15.408468,0 days 00:00:02.416299,entropy,14,sqrt,9,47,830,"{""criterion"": ""entropy"", ""max_depth"": 14, ""max_features"": ""sqrt"", ""min_samples_leaf"": 9, ""min_samples_split"": 47, ""n_estimators"": 830}",PRUNED
99,0.23002417401560005,2026-09-19 04:00:15.408468,2026-09-19 04:00:20.410040,0 days 00:00:05.001572,entropy,16,sqrt,13,49,901,"{""criterion"": ""entropy"", ""max_depth"": 16, ""max_features"": ""sqrt"", ""min_samples_leaf"": 13, ""min_samples_split"": 49, ""n_estimators"": 901}",PRUNED
