number,value,datetime_start,datetime_complete,duration,params_criterion,params_max_depth,params_max_features,params_min_samples_leaf,params_min_samples_split,params_n_estimators,system_attrs_tpe:relative_params:0,state
82,0.21548799884049757,2026-09-19 04:24:05.091111,2026-09-19 04:24:09.906658,0 days 00:00:04.815547,entropy,24,log2,7,43,725,"{""criterion"": ""entropy"", ""max_depth"": 24, ""max_features"": ""log2"", ""min_samples_leaf"": 7, ""min_samples_split"": 43, ""n_estimators"": 725}",PRUNED
83,0.21538114450435847,2026-09-19 04:24:09.906658,2026-09-19 04:24:16.098030,0 days 00:00:06.191372,entropy,21,log2,5,44,973,"{""criterion"": ""entropy"", ""max_depth"": 21, ""max_features"": ""log2"", ""min_samples_leaf"": 5, ""min_samples_split"": 44, ""n_estimators"": 973}",PRUNED
84,0.21586720522058078,2026-09-19 04:24:16.098030,2026-09-19 04:24:21.640417,0 days 00:00:05.542387,entropy,20,log2,5,45,856,"{""criterion"": ""entropy"", ""max_depth"": 20, ""max_features"": ""log2"", ""min_samples_leaf"": 5, ""min_samples_split"": 45, ""n_estimators"": 856}",PRUNED
85,0.2657031651107757,2026-09-19 04:24:21.640417,2026-09-19 04:24:36.019072,0 days 00:00:14.378655,entropy,24,log2,4,47,899,"{""criterion"": ""entropy"", ""max_depth"": 24, ""max_features"": ""log2"", ""min_samples_leaf"": 4, ""min_samples_split"": 47, ""n_estimators"": 899}",COMPLETE
86,0.21596324078119283,2026-09-19 04:24:36.019072,2026-09-19 04:24:41.031942,0 days 00:00:05.012870,entropy,25,log2,7,47,813,"{""criterion"": ""entropy"", ""max_depth"": 25, ""max_features"": ""log2"", ""min_samples_leaf"": 7, ""min_samples_split"": 47, ""n_estimators"": 813}",PRUNED
87,0.2656008453461195,2026-09-19 04:24:41.031942,2026-09-19 04:24:53.871926,0 days 00:00:12.839984,entropy,24,log2,4,50,815,"{""criterion"": ""entropy"", ""max_depth"": 24, ""max_features"": ""log2"", ""min_samples_leaf"": 4, ""min_samples_split"": 50, ""n_estimators"": 815}",COMPLETE
88,0.2461640520442951,2026-09-19 04:24:53.871926,2026-09-19 04:25:04.613176,0 days 00:00:10.741250,entropy,25,log2,5,43,878,"{""criterion"": ""entropy"", ""max_depth"": 25, ""max_features"": ""log2"", ""min_samples_leaf"": 5, ""min_samples_split"": 43, ""n_estimators"": 878}",PRUNED
89,0.21412929226611221,2026-09-19 04:25:04.613176,2026-09-19 04:25:10.767615,0 days 00:00:06.154439,entropy,25,log2,6,50,961,"{""criterion"": ""entropy"", ""max_depth"": 25, ""max_features"": ""log2"", ""min_samples_leaf"": 6, ""min_samples_split"": 50, ""n_estimators"": 961}",PRUNED
90,0.267627592651457,2026-09-19 04:25:10.767615,2026-09-19 04:25:24.252907,0 days 00:00:13.485292,entropy,24,log2,3,46,815,"{""criterion"": ""entropy"", ""max_depth"": 24, ""max_features"": ""log2"", ""min_samples_leaf"": 3, ""min_samples_split"": 46, ""n_estimators"": 815}",COMPLETE
91,0.17503729107831395,2026-09-19 04:25:24.252907,2026-09-19 04:25:27.267723,0 days 00:00:03.014816,entropy,25,log2,2,45,808,"{""criterion"": ""entropy"", ""max_depth"": 25, ""max_features"": ""log2"", ""min_samples_leaf"": 2, ""min_samples_split"": 45, ""n_estimators"": 808}",PRUNED
92,0.2644244665172594,2026-09-19 04:25:27.267723,2026-09-19 04:25:41.028559,0 days 00:00:13.760836,entropy,24,log2,5,50,865,"{""criterion"": ""entropy"", ""max_depth"": 24, ""max_features"": ""log2"", ""min_samples_leaf"": 5, ""min_samples_split"": 50, ""n_estimators"": 865}",COMPLETE
93,0.266841283998284,2026-09-19 04:25:41.028559,2026-09-19 04:25:53.358753,0 days 00:00:12.330194,entropy,23,log2,3,46,773,"{""criterion"": ""entropy"", ""max_depth"": 23, ""max_features"": ""log2"", ""min_samples_leaf"": 3, ""min_samples_split"": 46, ""n_estimators"": 773}",COMPLETE
94,0.21274245284563523,2026-09-19 04:25:53.360259,2026-09-19 04:25:58.442876,0 days 00:00:05.082617,entropy,23,log2,5,49,815,"{""criterion"": ""entropy"", ""max_depth"": 23, ""max_features"": ""log2"", ""min_samples_leaf"": 5, ""min_samples_split"": 49, ""n_estimators"": 815}",PRUNED
95,0.27018901844073906,2026-09-19 04:25:58.442876,2026-09-19 04:26:12.949936,0 days 00:00:14.507060,entropy,24,log2,3,42,885,"{""criterion"": ""entropy"", ""max_depth"": 24, ""max_features"": ""log2"", ""min_samples_leaf"": 3, ""min_samples_split"": 42, ""n_estimators"": 885}",COMPLETE
96,0.2160104406824472,2026-09-19 04:26:12.949936,2026-09-19 04:26:18.749264,0 days 00:00:05.799328,entropy,25,log2,4,49,882,"{""criterion"": ""entropy"", ""max_depth"": 25, ""max_features"": ""log2"", ""min_samples_leaf"": 4, ""min_samples_split"": 49, ""n_estimators"": 882}",PRUNED
97,0.2685676454171995,2026-09-19 04:26:18.749264,2026-09-19 04:26:32.707277,0 days 00:00:13.958013,entropy,22,log2,3,49,884,"{""criterion"": ""entropy"", ""max_depth"": 22, ""max_features"": ""log2"", ""min_samples_leaf"": 3, ""min_samples_split"": 49, ""n_estimators"": 884}",COMPLETE
98,0.26751613356470366,2026-09-19 04:26:32.707277,2026-09-19 04:26:46.379634,0 days 00:00:13.672357,entropy,22,log2,3,46,825,"{""criterion"": ""entropy"", ""max_depth"": 22, ""max_features"": ""log2"", ""min_samples_leaf"": 3, ""min_samples_split"": 46, ""n_estimators"": 825}",COMPLETE
99,0.2680679927137519,2026-09-19 04:26:46.379634,2026-09-19 04:27:01.486277,0 days 00:00:15.106643,entropy,24,log2,2,48,910,"{""criterion"": ""entropy"", ""max_depth"": 24, ""max_features"": ""log2"", ""min_samples_leaf"": 2, ""min_samples_split"": 48, ""n_estimators"": 910}",COMPLETE
