number,value,datetime_start,datetime_complete,duration,params_criterion,params_max_depth,params_max_features,params_min_samples_leaf,params_min_samples_split,params_n_estimators,system_attrs_tpe:relative_params:0,state
82,0.2874635163639131,2026-09-19 03:50:25.840538,2026-09-19 03:50:30.096865,0 days 00:00:04.256327,gini,7,log2,1,23,341,"{""criterion"": ""gini"", ""max_depth"": 7, ""max_features"": ""log2"", ""min_samples_leaf"": 1, ""min_samples_split"": 23, ""n_estimators"": 341}",COMPLETE
83,0.27434901724780697,2026-09-19 03:50:30.096865,2026-09-19 03:50:30.814332,0 days 00:00:00.717467,gini,5,log2,2,21,292,"{""criterion"": ""gini"", ""max_depth"": 5, ""max_features"": ""log2"", ""min_samples_leaf"": 2, ""min_samples_split"": 21, ""n_estimators"": 292}",PRUNED
84,0.2821524766260931,2026-09-19 03:50:30.814332,2026-09-19 03:50:31.968773,0 days 00:00:01.154441,gini,3,log2,1,46,257,"{""criterion"": ""gini"", ""max_depth"": 3, ""max_features"": ""log2"", ""min_samples_leaf"": 1, ""min_samples_split"": 46, ""n_estimators"": 257}",PRUNED
85,0.29026381877414165,2026-09-19 03:50:31.968773,2026-09-19 03:50:33.494929,0 days 00:00:01.526156,gini,6,log2,5,49,119,"{""criterion"": ""gini"", ""max_depth"": 6, ""max_features"": ""log2"", ""min_samples_leaf"": 5, ""min_samples_split"": 49, ""n_estimators"": 119}",PRUNED
86,0.29227037530337846,2026-09-19 03:50:33.494929,2026-09-19 03:50:36.731891,0 days 00:00:03.236962,gini,7,log2,1,50,291,"{""criterion"": ""gini"", ""max_depth"": 7, ""max_features"": ""log2"", ""min_samples_leaf"": 1, ""min_samples_split"": 50, ""n_estimators"": 291}",PRUNED
87,0.2891313882312369,2026-09-19 03:50:36.731891,2026-09-19 03:50:38.313531,0 days 00:00:01.581640,gini,4,log2,3,41,174,"{""criterion"": ""gini"", ""max_depth"": 4, ""max_features"": ""log2"", ""min_samples_leaf"": 3, ""min_samples_split"": 41, ""n_estimators"": 174}",PRUNED
88,0.2769085118444515,2026-09-19 03:50:38.313531,2026-09-19 03:50:39.958205,0 days 00:00:01.644674,gini,10,log2,2,28,296,"{""criterion"": ""gini"", ""max_depth"": 10, ""max_features"": ""log2"", ""min_samples_leaf"": 2, ""min_samples_split"": 28, ""n_estimators"": 296}",PRUNED
89,0.28193342316381703,2026-09-19 03:50:39.958205,2026-09-19 03:50:44.497385,0 days 00:00:04.539180,gini,8,log2,1,27,366,"{""criterion"": ""gini"", ""max_depth"": 8, ""max_features"": ""log2"", ""min_samples_leaf"": 1, ""min_samples_split"": 27, ""n_estimators"": 366}",COMPLETE
90,0.27410855499441117,2026-09-19 03:50:44.497385,2026-09-19 03:50:45.005734,0 days 00:00:00.508349,gini,6,log2,1,40,160,"{""criterion"": ""gini"", ""max_depth"": 6, ""max_features"": ""log2"", ""min_samples_leaf"": 1, ""min_samples_split"": 40, ""n_estimators"": 160}",PRUNED
91,0.2856200516404675,2026-09-19 03:50:45.005734,2026-09-19 03:50:50.031101,0 days 00:00:05.025367,gini,7,log2,1,21,355,"{""criterion"": ""gini"", ""max_depth"": 7, ""max_features"": ""log2"", ""min_samples_leaf"": 1, ""min_samples_split"": 21, ""n_estimators"": 355}",COMPLETE
92,0.28758254593302013,2026-09-19 03:50:50.031101,2026-09-19 03:50:51.339298,0 days 00:00:01.308197,gini,6,log2,2,44,113,"{""criterion"": ""gini"", ""max_depth"": 6, ""max_features"": ""log2"", ""min_samples_leaf"": 2, ""min_samples_split"": 44, ""n_estimators"": 113}",PRUNED
93,0.29272446822666753,2026-09-19 03:50:51.339298,2026-09-19 03:50:54.765189,0 days 00:00:03.425891,gini,6,log2,1,19,385,"{""criterion"": ""gini"", ""max_depth"": 6, ""max_features"": ""log2"", ""min_samples_leaf"": 1, ""min_samples_split"": 19, ""n_estimators"": 385}",PRUNED
94,0.27141133387000954,2026-09-19 03:50:54.765189,2026-09-19 03:50:55.625158,0 days 00:00:00.859969,gini,9,log2,1,30,242,"{""criterion"": ""gini"", ""max_depth"": 9, ""max_features"": ""log2"", ""min_samples_leaf"": 1, ""min_samples_split"": 30, ""n_estimators"": 242}",PRUNED
95,0.2845481357534093,2026-09-19 03:50:55.626158,2026-09-19 03:50:58.666914,0 days 00:00:03.040756,gini,7,log2,2,20,286,"{""criterion"": ""gini"", ""max_depth"": 7, ""max_features"": ""log2"", ""min_samples_leaf"": 2, ""min_samples_split"": 20, ""n_estimators"": 286}",COMPLETE
96,0.27245318956855086,2026-09-19 03:50:58.666914,2026-09-19 03:50:59.405451,0 days 00:00:00.738537,gini,9,log2,2,16,284,"{""criterion"": ""gini"", ""max_depth"": 9, ""max_features"": ""log2"", ""min_samples_leaf"": 2, ""min_samples_split"": 16, ""n_estimators"": 284}",PRUNED
97,0.2921253462681979,2026-09-19 03:50:59.405451,2026-09-19 03:51:01.448551,0 days 00:00:02.043100,gini,6,log2,1,24,193,"{""criterion"": ""gini"", ""max_depth"": 6, ""max_features"": ""log2"", ""min_samples_leaf"": 1, ""min_samples_split"": 24, ""n_estimators"": 193}",PRUNED
98,0.2907118141071816,2026-09-19 03:51:01.448551,2026-09-19 03:51:05.485851,0 days 00:00:04.037300,gini,7,log2,2,21,269,"{""criterion"": ""gini"", ""max_depth"": 7, ""max_features"": ""log2"", ""min_samples_leaf"": 2, ""min_samples_split"": 21, ""n_estimators"": 269}",COMPLETE
99,0.28897444098493513,2026-09-19 03:51:05.485851,2026-09-19 03:51:07.950877,0 days 00:00:02.465026,gini,8,log2,1,20,164,"{""criterion"": ""gini"", ""max_depth"": 8, ""max_features"": ""log2"", ""min_samples_leaf"": 1, ""min_samples_split"": 20, ""n_estimators"": 164}",COMPLETE
