number,value,datetime_start,datetime_complete,duration,params_criterion,params_max_depth,params_max_features,params_min_samples_leaf,params_min_samples_split,params_n_estimators,system_attrs_tpe:relative_params:0,state
0,0.26661952724678056,2026-09-19 03:44:56.374826,2026-09-19 03:45:17.196249,0 days 00:00:20.821423,gini,24,0.5,12,37,437,,COMPLETE
1,0.27284471589810166,2026-09-19 03:45:17.196249,2026-09-19 03:45:48.154150,0 days 00:00:30.957901,gini,22,0.25,4,12,973,,COMPLETE
2,0.2676131706384258,2026-09-19 03:45:48.154150,2026-09-19 03:46:07.425392,0 days 00:00:19.271242,gini,11,0.75,16,24,363,,COMPLETE
3,0.2749949190196376,2026-09-19 03:46:07.425392,2026-09-19 03:46:20.555700,0 days 00:00:13.130308,entropy,25,log2,7,41,954,,COMPLETE
4,0.2618759405455018,2026-09-19 03:46:20.555700,2026-09-19 03:46:29.493987,0 days 00:00:08.938287,gini,18,0.25,11,17,333,,COMPLETE
5,0.2712413118878566,2026-09-19 03:46:29.493987,2026-09-19 03:46:55.869165,0 days 00:00:26.375178,entropy,5,0.5,1,11,930,,COMPLETE
6,0.25943913376333905,2026-09-19 03:46:55.869165,2026-09-19 03:46:57.691873,0 days 00:00:01.822708,entropy,21,0.5,20,5,226,,PRUNED
7,0.2604238601485706,2026-09-19 03:46:57.691873,2026-09-19 03:46:58.216289,0 days 00:00:00.524416,gini,11,sqrt,18,7,166,,PRUNED
8,0.2553715269585173,2026-09-19 03:46:58.216289,2026-09-19 03:47:02.340718,0 days 00:00:04.124429,gini,13,0.25,15,7,899,,PRUNED
9,0.27588740607874296,2026-09-19 03:47:02.340718,2026-09-19 03:47:04.872375,0 days 00:00:02.531657,gini,3,log2,7,33,197,,COMPLETE
10,0.26826645023544804,2026-09-19 03:47:04.872375,2026-09-19 03:47:08.178557,0 days 00:00:03.306182,gini,3,log2,10,41,324,"{""criterion"": ""gini"", ""max_depth"": 3, ""max_features"": ""log2"", ""min_samples_leaf"": 10, ""min_samples_split"": 41, ""n_estimators"": 324}",COMPLETE
11,0.27258508272444926,2026-09-19 03:47:08.178557,2026-09-19 03:47:10.106874,0 days 00:00:01.928317,gini,15,log2,8,41,111,"{""criterion"": ""gini"", ""max_depth"": 15, ""max_features"": ""log2"", ""min_samples_leaf"": 8, ""min_samples_split"": 41, ""n_estimators"": 111}",COMPLETE
12,0.26182159569053326,2026-09-19 03:47:10.106874,2026-09-19 03:47:12.567220,0 days 00:00:02.460346,entropy,14,log2,11,38,981,"{""criterion"": ""entropy"", ""max_depth"": 14, ""max_features"": ""log2"", ""min_samples_leaf"": 11, ""min_samples_split"": 38, ""n_estimators"": 981}",PRUNED
13,0.2628861769360936,2026-09-19 03:47:12.567220,2026-09-19 03:47:14.138478,0 days 00:00:01.571258,entropy,24,log2,5,34,613,"{""criterion"": ""entropy"", ""max_depth"": 24, ""max_features"": ""log2"", ""min_samples_leaf"": 5, ""min_samples_split"": 34, ""n_estimators"": 613}",PRUNED
14,0.2792975880937276,2026-09-19 03:47:14.138478,2026-09-19 03:47:20.398274,0 days 00:00:06.259796,gini,13,log2,8,39,454,"{""criterion"": ""gini"", ""max_depth"": 13, ""max_features"": ""log2"", ""min_samples_leaf"": 8, ""min_samples_split"": 39, ""n_estimators"": 454}",COMPLETE
15,0.26053040561797336,2026-09-19 03:47:20.398274,2026-09-19 03:47:21.538913,0 days 00:00:01.140639,gini,16,log2,6,35,438,"{""criterion"": ""gini"", ""max_depth"": 16, ""max_features"": ""log2"", ""min_samples_leaf"": 6, ""min_samples_split"": 35, ""n_estimators"": 438}",PRUNED
16,0.2801007646968595,2026-09-19 03:47:21.538913,2026-09-19 03:47:27.832472,0 days 00:00:06.293559,gini,5,log2,4,29,586,"{""criterion"": ""gini"", ""max_depth"": 5, ""max_features"": ""log2"", ""min_samples_leaf"": 4, ""min_samples_split"": 29, ""n_estimators"": 586}",COMPLETE
17,0.2815843729302224,2026-09-19 03:47:27.832472,2026-09-19 03:47:33.031004,0 days 00:00:05.198532,gini,9,log2,2,35,415,"{""criterion"": ""gini"", ""max_depth"": 9, ""max_features"": ""log2"", ""min_samples_leaf"": 2, ""min_samples_split"": 35, ""n_estimators"": 415}",COMPLETE
18,0.2795757768585506,2026-09-19 03:47:33.031004,2026-09-19 03:47:37.754659,0 days 00:00:04.723655,gini,5,log2,2,35,479,"{""criterion"": ""gini"", ""max_depth"": 5, ""max_features"": ""log2"", ""min_samples_leaf"": 2, ""min_samples_split"": 35, ""n_estimators"": 479}",COMPLETE
19,0.2821000604291359,2026-09-19 03:47:37.754659,2026-09-19 03:47:43.983687,0 days 00:00:06.229028,gini,8,log2,5,24,528,"{""criterion"": ""gini"", ""max_depth"": 8, ""max_features"": ""log2"", ""min_samples_leaf"": 5, ""min_samples_split"": 24, ""n_estimators"": 528}",COMPLETE
20,0.2672411018999731,2026-09-19 03:47:43.983687,2026-09-19 03:47:45.524576,0 days 00:00:01.540889,gini,13,log2,2,21,593,"{""criterion"": ""gini"", ""max_depth"": 13, ""max_features"": ""log2"", ""min_samples_leaf"": 2, ""min_samples_split"": 21, ""n_estimators"": 593}",PRUNED
21,0.28109577236857547,2026-09-19 03:47:45.524576,2026-09-19 03:47:52.445745,0 days 00:00:06.921169,gini,8,log2,6,28,562,"{""criterion"": ""gini"", ""max_depth"": 8, ""max_features"": ""log2"", ""min_samples_leaf"": 6, ""min_samples_split"": 28, ""n_estimators"": 562}",COMPLETE
22,0.2619281545312386,2026-09-19 03:47:52.446744,2026-09-19 03:47:54.162533,0 days 00:00:01.715789,gini,9,log2,9,23,610,"{""criterion"": ""gini"", ""max_depth"": 9, ""max_features"": ""log2"", ""min_samples_leaf"": 9, ""min_samples_split"": 23, ""n_estimators"": 610}",PRUNED
23,0.2651534302845711,2026-09-19 03:47:54.162533,2026-09-19 03:47:58.734511,0 days 00:00:04.571978,gini,10,0.5,6,33,591,"{""criterion"": ""gini"", ""max_depth"": 10, ""max_features"": 0.5, ""min_samples_leaf"": 6, ""min_samples_split"": 33, ""n_estimators"": 591}",PRUNED
24,0.25879652235279643,2026-09-19 03:47:58.734511,2026-09-19 03:47:59.859294,0 days 00:00:01.124783,gini,8,log2,5,14,502,"{""criterion"": ""gini"", ""max_depth"": 8, ""max_features"": ""log2"", ""min_samples_leaf"": 5, ""min_samples_split"": 14, ""n_estimators"": 502}",PRUNED
25,0.2836090654287817,2026-09-19 03:47:59.859294,2026-09-19 03:48:06.191622,0 days 00:00:06.332328,gini,7,log2,3,48,489,"{""criterion"": ""gini"", ""max_depth"": 7, ""max_features"": ""log2"", ""min_samples_leaf"": 3, ""min_samples_split"": 48, ""n_estimators"": 489}",COMPLETE
26,0.26792121678009,2026-09-19 03:48:06.191622,2026-09-19 03:48:07.656975,0 days 00:00:01.465353,gini,11,sqrt,2,44,495,"{""criterion"": ""gini"", ""max_depth"": 11, ""max_features"": ""sqrt"", ""min_samples_leaf"": 2, ""min_samples_split"": 44, ""n_estimators"": 495}",PRUNED
27,0.27651659609892554,2026-09-19 03:48:07.656975,2026-09-19 03:48:12.535955,0 days 00:00:04.878980,gini,9,log2,3,36,669,"{""criterion"": ""gini"", ""max_depth"": 9, ""max_features"": ""log2"", ""min_samples_leaf"": 3, ""min_samples_split"": 36, ""n_estimators"": 669}",PRUNED
28,0.2799135333251136,2026-09-19 03:48:12.535955,2026-09-19 03:48:16.976327,0 days 00:00:04.440372,gini,11,log2,2,43,339,"{""criterion"": ""gini"", ""max_depth"": 11, ""max_features"": ""log2"", ""min_samples_leaf"": 2, ""min_samples_split"": 43, ""n_estimators"": 339}",COMPLETE
29,0.28274698478567917,2026-09-19 03:48:16.976327,2026-09-19 03:48:22.533806,0 days 00:00:05.557479,gini,5,log2,3,44,495,"{""criterion"": ""gini"", ""max_depth"": 5, ""max_features"": ""log2"", ""min_samples_leaf"": 3, ""min_samples_split"": 44, ""n_estimators"": 495}",COMPLETE
30,0.271093211173641,2026-09-19 03:48:22.533806,2026-09-19 03:48:23.550015,0 days 00:00:01.016209,gini,7,log2,6,49,476,"{""criterion"": ""gini"", ""max_depth"": 7, ""max_features"": ""log2"", ""min_samples_leaf"": 6, ""min_samples_split"": 49, ""n_estimators"": 476}",PRUNED
31,0.28295695751052446,2026-09-19 03:48:23.550015,2026-09-19 03:48:30.680377,0 days 00:00:07.130362,gini,7,log2,1,43,608,"{""criterion"": ""gini"", ""max_depth"": 7, ""max_features"": ""log2"", ""min_samples_leaf"": 1, ""min_samples_split"": 43, ""n_estimators"": 608}",COMPLETE
32,0.2818751814062559,2026-09-19 03:48:30.680377,2026-09-19 03:48:37.355925,0 days 00:00:06.675548,gini,7,log2,2,48,533,"{""criterion"": ""gini"", ""max_depth"": 7, ""max_features"": ""log2"", ""min_samples_leaf"": 2, ""min_samples_split"": 48, ""n_estimators"": 533}",COMPLETE
33,0.2784271443662737,2026-09-19 03:48:37.355925,2026-09-19 03:48:44.177230,0 days 00:00:06.821305,gini,4,log2,3,44,746,"{""criterion"": ""gini"", ""max_depth"": 4, ""max_features"": ""log2"", ""min_samples_leaf"": 3, ""min_samples_split"": 44, ""n_estimators"": 746}",COMPLETE
34,0.27096056902036025,2026-09-19 03:48:44.177230,2026-09-19 03:48:45.233897,0 days 00:00:01.056667,gini,8,log2,6,42,411,"{""criterion"": ""gini"", ""max_depth"": 8, ""max_features"": ""log2"", ""min_samples_leaf"": 6, ""min_samples_split"": 42, ""n_estimators"": 411}",PRUNED
35,0.28422490068587597,2026-09-19 03:48:45.233897,2026-09-19 03:48:49.244204,0 days 00:00:04.010307,gini,7,log2,2,29,296,"{""criterion"": ""gini"", ""max_depth"": 7, ""max_features"": ""log2"", ""min_samples_leaf"": 2, ""min_samples_split"": 29, ""n_estimators"": 296}",COMPLETE
36,0.27055359070371543,2026-09-19 03:48:49.244204,2026-09-19 03:48:50.173593,0 days 00:00:00.929389,gini,8,log2,4,30,337,"{""criterion"": ""gini"", ""max_depth"": 8, ""max_features"": ""log2"", ""min_samples_leaf"": 4, ""min_samples_split"": 30, ""n_estimators"": 337}",PRUNED
37,0.27548294748614643,2026-09-19 03:48:50.173593,2026-09-19 03:48:53.865250,0 days 00:00:03.691657,gini,9,log2,2,49,715,"{""criterion"": ""gini"", ""max_depth"": 9, ""max_features"": ""log2"", ""min_samples_leaf"": 2, ""min_samples_split"": 49, ""n_estimators"": 715}",PRUNED
38,0.28372127348336007,2026-09-19 03:48:53.865250,2026-09-19 03:48:57.161546,0 days 00:00:03.296296,gini,6,log2,1,26,423,"{""criterion"": ""gini"", ""max_depth"": 6, ""max_features"": ""log2"", ""min_samples_leaf"": 1, ""min_samples_split"": 26, ""n_estimators"": 423}",PRUNED
39,0.27895785225229375,2026-09-19 03:48:57.161546,2026-09-19 03:48:59.981268,0 days 00:00:02.819722,gini,10,log2,1,41,209,"{""criterion"": ""gini"", ""max_depth"": 10, ""max_features"": ""log2"", ""min_samples_leaf"": 1, ""min_samples_split"": 41, ""n_estimators"": 209}",COMPLETE
40,0.28387963015800893,2026-09-19 03:48:59.981268,2026-09-19 03:49:03.343818,0 days 00:00:03.362550,gini,7,log2,1,49,241,"{""criterion"": ""gini"", ""max_depth"": 7, ""max_features"": ""log2"", ""min_samples_leaf"": 1, ""min_samples_split"": 49, ""n_estimators"": 241}",COMPLETE
41,0.2822894833286275,2026-09-19 03:49:03.343818,2026-09-19 03:49:07.216960,0 days 00:00:03.873142,gini,8,0.25,2,45,318,"{""criterion"": ""gini"", ""max_depth"": 8, ""max_features"": 0.25, ""min_samples_leaf"": 2, ""min_samples_split"": 45, ""n_estimators"": 318}",PRUNED
42,0.2713545260309063,2026-09-19 03:49:07.216960,2026-09-19 03:49:08.156818,0 days 00:00:00.939858,gini,6,0.5,4,45,161,"{""criterion"": ""gini"", ""max_depth"": 6, ""max_features"": 0.5, ""min_samples_leaf"": 4, ""min_samples_split"": 45, ""n_estimators"": 161}",PRUNED
43,0.2840240454958102,2026-09-19 03:49:08.156818,2026-09-19 03:49:11.877202,0 days 00:00:03.720384,gini,5,log2,3,49,308,"{""criterion"": ""gini"", ""max_depth"": 5, ""max_features"": ""log2"", ""min_samples_leaf"": 3, ""min_samples_split"": 49, ""n_estimators"": 308}",COMPLETE
44,0.276007968689071,2026-09-19 03:49:11.877202,2026-09-19 03:49:15.382041,0 days 00:00:03.504839,gini,4,log2,3,49,314,"{""criterion"": ""gini"", ""max_depth"": 4, ""max_features"": ""log2"", ""min_samples_leaf"": 3, ""min_samples_split"": 49, ""n_estimators"": 314}",COMPLETE
45,0.26319295248857594,2026-09-19 03:49:15.382041,2026-09-19 03:49:15.962722,0 days 00:00:00.580681,gini,10,log2,6,49,188,"{""criterion"": ""gini"", ""max_depth"": 10, ""max_features"": ""log2"", ""min_samples_leaf"": 6, ""min_samples_split"": 49, ""n_estimators"": 188}",PRUNED
46,0.27011199750536785,2026-09-19 03:49:15.962722,2026-09-19 03:49:16.373898,0 days 00:00:00.411176,gini,10,log2,3,48,135,"{""criterion"": ""gini"", ""max_depth"": 10, ""max_features"": ""log2"", ""min_samples_leaf"": 3, ""min_samples_split"": 48, ""n_estimators"": 135}",PRUNED
47,0.2881492381046066,2026-09-19 03:49:16.373898,2026-09-19 03:49:19.926776,0 days 00:00:03.552878,gini,4,log2,3,37,376,"{""criterion"": ""gini"", ""max_depth"": 4, ""max_features"": ""log2"", ""min_samples_leaf"": 3, ""min_samples_split"": 37, ""n_estimators"": 376}",PRUNED
48,0.27275127008131644,2026-09-19 03:49:19.926776,2026-09-19 03:49:21.090827,0 days 00:00:01.164051,gini,8,log2,3,49,408,"{""criterion"": ""gini"", ""max_depth"": 8, ""max_features"": ""log2"", ""min_samples_leaf"": 3, ""min_samples_split"": 49, ""n_estimators"": 408}",PRUNED
49,0.26770644118188375,2026-09-19 03:49:21.090827,2026-09-19 03:49:22.531415,0 days 00:00:01.440588,gini,12,log2,4,47,566,"{""criterion"": ""gini"", ""max_depth"": 12, ""max_features"": ""log2"", ""min_samples_leaf"": 4, ""min_samples_split"": 47, ""n_estimators"": 566}",PRUNED
50,0.28542265472730144,2026-09-19 03:49:22.531415,2026-09-19 03:49:25.484615,0 days 00:00:02.953200,gini,7,log2,1,43,197,"{""criterion"": ""gini"", ""max_depth"": 7, ""max_features"": ""log2"", ""min_samples_leaf"": 1, ""min_samples_split"": 43, ""n_estimators"": 197}",COMPLETE
51,0.28345277051692447,2026-09-19 03:49:25.485623,2026-09-19 03:49:28.774717,0 days 00:00:03.289094,gini,7,log2,2,41,252,"{""criterion"": ""gini"", ""max_depth"": 7, ""max_features"": ""log2"", ""min_samples_leaf"": 2, ""min_samples_split"": 41, ""n_estimators"": 252}",COMPLETE
52,0.2839558340575349,2026-09-19 03:49:28.774717,2026-09-19 03:49:31.597665,0 days 00:00:02.822948,gini,7,log2,2,46,168,"{""criterion"": ""gini"", ""max_depth"": 7, ""max_features"": ""log2"", ""min_samples_leaf"": 2, ""min_samples_split"": 46, ""n_estimators"": 168}",COMPLETE
53,0.282580711202781,2026-09-19 03:49:31.597665,2026-09-19 03:49:33.476900,0 days 00:00:01.879235,gini,6,log2,2,36,195,"{""criterion"": ""gini"", ""max_depth"": 6, ""max_features"": ""log2"", ""min_samples_leaf"": 2, ""min_samples_split"": 36, ""n_estimators"": 195}",PRUNED
54,0.2691464955297034,2026-09-19 03:49:33.476900,2026-09-19 03:49:34.114439,0 days 00:00:00.637539,gini,8,log2,6,44,209,"{""criterion"": ""gini"", ""max_depth"": 8, ""max_features"": ""log2"", ""min_samples_leaf"": 6, ""min_samples_split"": 44, ""n_estimators"": 209}",PRUNED
55,0.2836799798069057,2026-09-19 03:49:34.114439,2026-09-19 03:49:38.312317,0 days 00:00:04.197878,gini,9,log2,1,47,267,"{""criterion"": ""gini"", ""max_depth"": 9, ""max_features"": ""log2"", ""min_samples_leaf"": 1, ""min_samples_split"": 47, ""n_estimators"": 267}",COMPLETE
56,0.28329071226577396,2026-09-19 03:49:38.313313,2026-09-19 03:49:41.493540,0 days 00:00:03.180227,gini,6,log2,6,47,283,"{""criterion"": ""gini"", ""max_depth"": 6, ""max_features"": ""log2"", ""min_samples_leaf"": 6, ""min_samples_split"": 47, ""n_estimators"": 283}",COMPLETE
57,0.28282874054412693,2026-09-19 03:49:41.493540,2026-09-19 03:49:46.337350,0 days 00:00:04.843810,gini,7,log2,2,44,413,"{""criterion"": ""gini"", ""max_depth"": 7, ""max_features"": ""log2"", ""min_samples_leaf"": 2, ""min_samples_split"": 44, ""n_estimators"": 413}",COMPLETE
58,0.27537611725291844,2026-09-19 03:49:46.337350,2026-09-19 03:49:46.991808,0 days 00:00:00.654458,gini,3,log2,1,40,168,"{""criterion"": ""gini"", ""max_depth"": 3, ""max_features"": ""log2"", ""min_samples_leaf"": 1, ""min_samples_split"": 40, ""n_estimators"": 168}",PRUNED
59,0.272096543560823,2026-09-19 03:49:46.991808,2026-09-19 03:49:47.560858,0 days 00:00:00.569050,gini,7,log2,5,35,246,"{""criterion"": ""gini"", ""max_depth"": 7, ""max_features"": ""log2"", ""min_samples_leaf"": 5, ""min_samples_split"": 35, ""n_estimators"": 246}",PRUNED
60,0.2873089036261882,2026-09-19 03:49:47.560858,2026-09-19 03:49:50.825577,0 days 00:00:03.264719,gini,4,log2,1,49,382,"{""criterion"": ""gini"", ""max_depth"": 4, ""max_features"": ""log2"", ""min_samples_leaf"": 1, ""min_samples_split"": 49, ""n_estimators"": 382}",PRUNED
61,0.271129503462725,2026-09-19 03:49:50.825577,2026-09-19 03:49:51.624104,0 days 00:00:00.798527,gini,10,log2,3,49,331,"{""criterion"": ""gini"", ""max_depth"": 10, ""max_features"": ""log2"", ""min_samples_leaf"": 3, ""min_samples_split"": 49, ""n_estimators"": 331}",PRUNED
62,0.28534180715199364,2026-09-19 03:49:51.625104,2026-09-19 03:49:54.634203,0 days 00:00:03.009099,gini,8,log2,2,26,241,"{""criterion"": ""gini"", ""max_depth"": 8, ""max_features"": ""log2"", ""min_samples_leaf"": 2, ""min_samples_split"": 26, ""n_estimators"": 241}",COMPLETE
63,0.27409861407814573,2026-09-19 03:49:54.634203,2026-09-19 03:49:55.079109,0 days 00:00:00.444906,gini,6,log2,1,50,152,"{""criterion"": ""gini"", ""max_depth"": 6, ""max_features"": ""log2"", ""min_samples_leaf"": 1, ""min_samples_split"": 50, ""n_estimators"": 152}",PRUNED
64,0.284943643832462,2026-09-19 03:49:55.079109,2026-09-19 03:49:57.118817,0 days 00:00:02.039708,gini,6,log2,1,46,266,"{""criterion"": ""gini"", ""max_depth"": 6, ""max_features"": ""log2"", ""min_samples_leaf"": 1, ""min_samples_split"": 46, ""n_estimators"": 266}",PRUNED
65,0.28513675488760415,2026-09-19 03:49:57.118817,2026-09-19 03:49:58.539966,0 days 00:00:01.421149,gini,8,log2,4,46,205,"{""criterion"": ""gini"", ""max_depth"": 8, ""max_features"": ""log2"", ""min_samples_leaf"": 4, ""min_samples_split"": 46, ""n_estimators"": 205}",PRUNED
66,0.26688795329594517,2026-09-19 03:49:58.539966,2026-09-19 03:49:59.140472,0 days 00:00:00.600506,gini,11,log2,1,50,213,"{""criterion"": ""gini"", ""max_depth"": 11, ""max_features"": ""log2"", ""min_samples_leaf"": 1, ""min_samples_split"": 50, ""n_estimators"": 213}",PRUNED
67,0.2739277153527912,2026-09-19 03:49:59.140472,2026-09-19 03:50:00.032620,0 days 00:00:00.892148,gini,5,log2,1,41,363,"{""criterion"": ""gini"", ""max_depth"": 5, ""max_features"": ""log2"", ""min_samples_leaf"": 1, ""min_samples_split"": 41, ""n_estimators"": 363}",PRUNED
68,0.28449644254935286,2026-09-19 03:50:00.032620,2026-09-19 03:50:03.621024,0 days 00:00:03.588404,gini,7,log2,2,25,305,"{""criterion"": ""gini"", ""max_depth"": 7, ""max_features"": ""log2"", ""min_samples_leaf"": 2, ""min_samples_split"": 25, ""n_estimators"": 305}",COMPLETE
69,0.28342532682731225,2026-09-19 03:50:03.621024,2026-09-19 03:50:06.341119,0 days 00:00:02.720095,gini,7,log2,3,50,178,"{""criterion"": ""gini"", ""max_depth"": 7, ""max_features"": ""log2"", ""min_samples_leaf"": 3, ""min_samples_split"": 50, ""n_estimators"": 178}",COMPLETE
70,0.28962399866247807,2026-09-19 03:50:06.341119,2026-09-19 03:50:08.460331,0 days 00:00:02.119212,gini,5,log2,3,41,154,"{""criterion"": ""gini"", ""max_depth"": 5, ""max_features"": ""log2"", ""min_samples_leaf"": 3, ""min_samples_split"": 41, ""n_estimators"": 154}",COMPLETE
71,0.28402037474393727,2026-09-19 03:50:08.460331,2026-09-19 03:50:10.322866,0 days 00:00:01.862535,gini,8,log2,2,28,216,"{""criterion"": ""gini"", ""max_depth"": 8, ""max_features"": ""log2"", ""min_samples_leaf"": 2, ""min_samples_split"": 28, ""n_estimators"": 216}",PRUNED
72,0.2802753076569592,2026-09-19 03:50:10.322866,2026-09-19 03:50:11.942024,0 days 00:00:01.619158,gini,4,log2,5,50,339,"{""criterion"": ""gini"", ""max_depth"": 4, ""max_features"": ""log2"", ""min_samples_leaf"": 5, ""min_samples_split"": 50, ""n_estimators"": 339}",PRUNED
73,0.2843825831460194,2026-09-19 03:50:11.942024,2026-09-19 03:50:13.092238,0 days 00:00:01.150214,gini,8,log2,2,46,110,"{""criterion"": ""gini"", ""max_depth"": 8, ""max_features"": ""log2"", ""min_samples_leaf"": 2, ""min_samples_split"": 46, ""n_estimators"": 110}",PRUNED
74,0.29217955655306854,2026-09-19 03:50:13.092238,2026-09-19 03:50:16.243701,0 days 00:00:03.151463,gini,6,log2,4,25,322,"{""criterion"": ""gini"", ""max_depth"": 6, ""max_features"": ""log2"", ""min_samples_leaf"": 4, ""min_samples_split"": 25, ""n_estimators"": 322}",PRUNED
75,0.27649949586670225,2026-09-19 03:50:16.243701,2026-09-19 03:50:17.797861,0 days 00:00:01.554160,gini,10,log2,3,23,308,"{""criterion"": ""gini"", ""max_depth"": 10, ""max_features"": ""log2"", ""min_samples_leaf"": 3, ""min_samples_split"": 23, ""n_estimators"": 308}",PRUNED
76,0.28788840199664684,2026-09-19 03:50:17.797861,2026-09-19 03:50:19.487497,0 days 00:00:01.689636,gini,4,log2,3,48,187,"{""criterion"": ""gini"", ""max_depth"": 4, ""max_features"": ""log2"", ""min_samples_leaf"": 3, ""min_samples_split"": 48, ""n_estimators"": 187}",PRUNED
77,0.270251897129256,2026-09-19 03:50:19.487497,2026-09-19 03:50:19.979869,0 days 00:00:00.492372,gini,11,log2,2,28,195,"{""criterion"": ""gini"", ""max_depth"": 11, ""max_features"": ""log2"", ""min_samples_leaf"": 2, ""min_samples_split"": 28, ""n_estimators"": 195}",PRUNED
78,0.28845036749410785,2026-09-19 03:50:19.979869,2026-09-19 03:50:22.821876,0 days 00:00:02.842007,gini,6,log2,1,29,245,"{""criterion"": ""gini"", ""max_depth"": 6, ""max_features"": ""log2"", ""min_samples_leaf"": 1, ""min_samples_split"": 29, ""n_estimators"": 245}",PRUNED
79,0.2890163745308929,2026-09-19 03:50:22.821876,2026-09-19 03:50:24.234639,0 days 00:00:01.412763,gini,6,log2,3,35,121,"{""criterion"": ""gini"", ""max_depth"": 6, ""max_features"": ""log2"", ""min_samples_leaf"": 3, ""min_samples_split"": 35, ""n_estimators"": 121}",PRUNED
80,0.2678969624978408,2026-09-19 03:50:24.234639,2026-09-19 03:50:24.562376,0 days 00:00:00.327737,gini,4,log2,5,42,118,"{""criterion"": ""gini"", ""max_depth"": 4, ""max_features"": ""log2"", ""min_samples_leaf"": 5, ""min_samples_split"": 42, ""n_estimators"": 118}",PRUNED
81,0.2760748709503641,2026-09-19 03:50:24.562376,2026-09-19 03:50:25.840538,0 days 00:00:01.278162,gini,7,log2,4,23,226,"{""criterion"": ""gini"", ""max_depth"": 7, ""max_features"": ""log2"", ""min_samples_leaf"": 4, ""min_samples_split"": 23, ""n_estimators"": 226}",PRUNED
