number,value,datetime_start,datetime_complete,duration,params_criterion,params_max_depth,params_max_features,params_min_samples_leaf,params_min_samples_split,params_n_estimators,system_attrs_tpe:relative_params:0,state
81,0.1880285556011441,2026-09-19 03:44:01.575743,2026-09-19 03:44:02.174541,0 days 00:00:00.598798,entropy,4,log2,2,37,307,"{""criterion"": ""entropy"", ""max_depth"": 4, ""max_features"": ""log2"", ""min_samples_leaf"": 2, ""min_samples_split"": 37, ""n_estimators"": 307}",PRUNED
82,0.18750943350144367,2026-09-19 03:44:02.174541,2026-09-19 03:44:03.005023,0 days 00:00:00.830482,entropy,3,log2,3,22,304,"{""criterion"": ""entropy"", ""max_depth"": 3, ""max_features"": ""log2"", ""min_samples_leaf"": 3, ""min_samples_split"": 22, ""n_estimators"": 304}",PRUNED
83,0.26503848652799133,2026-09-19 03:44:03.005023,2026-09-19 03:44:09.659365,0 days 00:00:06.654342,entropy,3,log2,3,23,658,"{""criterion"": ""entropy"", ""max_depth"": 3, ""max_features"": ""log2"", ""min_samples_leaf"": 3, ""min_samples_split"": 23, ""n_estimators"": 658}",COMPLETE
84,0.18868889202371872,2026-09-19 03:44:09.659365,2026-09-19 03:44:10.684762,0 days 00:00:01.025397,entropy,4,log2,1,40,528,"{""criterion"": ""entropy"", ""max_depth"": 4, ""max_features"": ""log2"", ""min_samples_leaf"": 1, ""min_samples_split"": 40, ""n_estimators"": 528}",PRUNED
85,0.18780396201649976,2026-09-19 03:44:10.684762,2026-09-19 03:44:12.009695,0 days 00:00:01.324933,entropy,7,log2,1,30,563,"{""criterion"": ""entropy"", ""max_depth"": 7, ""max_features"": ""log2"", ""min_samples_leaf"": 1, ""min_samples_split"": 30, ""n_estimators"": 563}",PRUNED
86,0.18999734515428804,2026-09-19 03:44:12.009695,2026-09-19 03:44:13.230930,0 days 00:00:01.221235,entropy,6,log2,5,27,478,"{""criterion"": ""entropy"", ""max_depth"": 6, ""max_features"": ""log2"", ""min_samples_leaf"": 5, ""min_samples_split"": 27, ""n_estimators"": 478}",PRUNED
87,0.18904364344626842,2026-09-19 03:44:13.230930,2026-09-19 03:44:14.055163,0 days 00:00:00.824233,entropy,4,log2,4,27,392,"{""criterion"": ""entropy"", ""max_depth"": 4, ""max_features"": ""log2"", ""min_samples_leaf"": 4, ""min_samples_split"": 27, ""n_estimators"": 392}",PRUNED
88,0.265112923146,2026-09-19 03:44:14.055163,2026-09-19 03:44:19.432915,0 days 00:00:05.377752,entropy,3,log2,3,19,510,"{""criterion"": ""entropy"", ""max_depth"": 3, ""max_features"": ""log2"", ""min_samples_leaf"": 3, ""min_samples_split"": 19, ""n_estimators"": 510}",COMPLETE
89,0.18961558949808915,2026-09-19 03:44:19.432915,2026-09-19 03:44:20.639509,0 days 00:00:01.206594,entropy,4,log2,1,23,616,"{""criterion"": ""entropy"", ""max_depth"": 4, ""max_features"": ""log2"", ""min_samples_leaf"": 1, ""min_samples_split"": 23, ""n_estimators"": 616}",PRUNED
90,0.1894550533209495,2026-09-19 03:44:20.639509,2026-09-19 03:44:21.837844,0 days 00:00:01.198335,entropy,3,log2,4,18,647,"{""criterion"": ""entropy"", ""max_depth"": 3, ""max_features"": ""log2"", ""min_samples_leaf"": 4, ""min_samples_split"": 18, ""n_estimators"": 647}",PRUNED
91,0.18320550561026286,2026-09-19 03:44:21.837844,2026-09-19 03:44:22.856079,0 days 00:00:01.018235,entropy,4,log2,2,17,524,"{""criterion"": ""entropy"", ""max_depth"": 4, ""max_features"": ""log2"", ""min_samples_leaf"": 2, ""min_samples_split"": 17, ""n_estimators"": 524}",PRUNED
92,0.18730973541431217,2026-09-19 03:44:22.856079,2026-09-19 03:44:23.776387,0 days 00:00:00.920308,entropy,6,log2,1,30,401,"{""criterion"": ""entropy"", ""max_depth"": 6, ""max_features"": ""log2"", ""min_samples_leaf"": 1, ""min_samples_split"": 30, ""n_estimators"": 401}",PRUNED
93,0.26596754338621276,2026-09-19 03:44:23.776387,2026-09-19 03:44:30.981966,0 days 00:00:07.205579,entropy,3,log2,2,19,717,"{""criterion"": ""entropy"", ""max_depth"": 3, ""max_features"": ""log2"", ""min_samples_leaf"": 2, ""min_samples_split"": 19, ""n_estimators"": 717}",COMPLETE
94,0.18536655083073517,2026-09-19 03:44:30.981966,2026-09-19 03:44:32.060864,0 days 00:00:01.078898,entropy,4,log2,3,22,561,"{""criterion"": ""entropy"", ""max_depth"": 4, ""max_features"": ""log2"", ""min_samples_leaf"": 3, ""min_samples_split"": 22, ""n_estimators"": 561}",PRUNED
95,0.2669701812761657,2026-09-19 03:44:32.060864,2026-09-19 03:44:39.227701,0 days 00:00:07.166837,entropy,3,log2,2,17,713,"{""criterion"": ""entropy"", ""max_depth"": 3, ""max_features"": ""log2"", ""min_samples_leaf"": 2, ""min_samples_split"": 17, ""n_estimators"": 713}",COMPLETE
96,0.1885974475796336,2026-09-19 03:44:39.227701,2026-09-19 03:44:40.649442,0 days 00:00:01.421741,entropy,4,log2,2,20,670,"{""criterion"": ""entropy"", ""max_depth"": 4, ""max_features"": ""log2"", ""min_samples_leaf"": 2, ""min_samples_split"": 20, ""n_estimators"": 670}",PRUNED
97,0.26466000620442454,2026-09-19 03:44:40.649442,2026-09-19 03:44:45.622213,0 days 00:00:04.972771,entropy,3,log2,1,33,485,"{""criterion"": ""entropy"", ""max_depth"": 3, ""max_features"": ""log2"", ""min_samples_leaf"": 1, ""min_samples_split"": 33, ""n_estimators"": 485}",COMPLETE
98,0.19060036058007254,2026-09-19 03:44:45.622213,2026-09-19 03:44:46.808113,0 days 00:00:01.185900,entropy,5,log2,1,36,477,"{""criterion"": ""entropy"", ""max_depth"": 5, ""max_features"": ""log2"", ""min_samples_leaf"": 1, ""min_samples_split"": 36, ""n_estimators"": 477}",PRUNED
99,0.2665201118901514,2026-09-19 03:44:46.808113,2026-09-19 03:44:54.942210,0 days 00:00:08.134097,entropy,3,log2,2,25,771,"{""criterion"": ""entropy"", ""max_depth"": 3, ""max_features"": ""log2"", ""min_samples_leaf"": 2, ""min_samples_split"": 25, ""n_estimators"": 771}",COMPLETE
