number,value,datetime_start,datetime_complete,duration,params_criterion,params_max_depth,params_max_features,params_min_samples_leaf,params_min_samples_split,params_n_estimators,system_attrs_tpe:relative_params:0,state
0,0.2296325636724852,2026-09-19 04:00:23.345657,2026-09-19 04:00:43.960622,0 days 00:00:20.614965,gini,24,0.5,12,37,437,,COMPLETE
1,0.24152626614065503,2026-09-19 04:00:43.961625,2026-09-19 04:01:14.701700,0 days 00:00:30.740075,gini,22,0.25,4,12,973,,COMPLETE
2,0.22530792299844477,2026-09-19 04:01:14.701700,2026-09-19 04:01:34.174687,0 days 00:00:19.472987,gini,11,0.75,16,24,363,,COMPLETE
3,0.24854801622200462,2026-09-19 04:01:34.174687,2026-09-19 04:01:47.092197,0 days 00:00:12.917510,entropy,25,log2,7,41,954,,COMPLETE
4,0.23705598539195805,2026-09-19 04:01:47.092197,2026-09-19 04:01:55.696357,0 days 00:00:08.604160,gini,18,0.25,11,17,333,,COMPLETE
5,0.23163996299728737,2026-09-19 04:01:55.696357,2026-09-19 04:02:00.969679,0 days 00:00:05.273322,entropy,5,0.5,1,11,930,,PRUNED
6,0.22186116878392118,2026-09-19 04:02:00.969679,2026-09-19 04:02:02.803533,0 days 00:00:01.833854,entropy,21,0.5,20,5,226,,PRUNED
7,0.25309375593347305,2026-09-19 04:02:02.804532,2026-09-19 04:02:03.430269,0 days 00:00:00.625737,gini,11,sqrt,18,7,166,,PRUNED
8,0.24882683263303115,2026-09-19 04:02:03.430269,2026-09-19 04:02:07.381819,0 days 00:00:03.951550,gini,13,0.25,15,7,899,,PRUNED
9,0.24126468270981047,2026-09-19 04:02:07.381819,2026-09-19 04:02:09.496650,0 days 00:00:02.114831,gini,3,log2,7,33,197,,COMPLETE
10,0.24725859128099437,2026-09-19 04:02:09.496650,2026-09-19 04:02:21.064727,0 days 00:00:11.568077,entropy,18,log2,4,20,788,"{""criterion"": ""entropy"", ""max_depth"": 18, ""max_features"": ""log2"", ""min_samples_leaf"": 4, ""min_samples_split"": 20, ""n_estimators"": 788}",COMPLETE
11,0.2480643009366239,2026-09-19 04:02:21.064727,2026-09-19 04:02:31.370461,0 days 00:00:10.305734,entropy,25,log2,5,28,666,"{""criterion"": ""entropy"", ""max_depth"": 25, ""max_features"": ""log2"", ""min_samples_leaf"": 5, ""min_samples_split"": 28, ""n_estimators"": 666}",COMPLETE
12,0.2507974499365685,2026-09-19 04:02:31.370461,2026-09-19 04:02:34.048137,0 days 00:00:02.677676,entropy,21,log2,11,38,990,"{""criterion"": ""entropy"", ""max_depth"": 21, ""max_features"": ""log2"", ""min_samples_leaf"": 11, ""min_samples_split"": 38, ""n_estimators"": 990}",PRUNED
13,0.24564272930419268,2026-09-19 04:02:34.048137,2026-09-19 04:02:44.827961,0 days 00:00:10.779824,entropy,25,log2,5,34,788,"{""criterion"": ""entropy"", ""max_depth"": 25, ""max_features"": ""log2"", ""min_samples_leaf"": 5, ""min_samples_split"": 34, ""n_estimators"": 788}",COMPLETE
14,0.2524240515892487,2026-09-19 04:02:44.827961,2026-09-19 04:02:57.681074,0 days 00:00:12.853113,entropy,25,log2,3,48,920,"{""criterion"": ""entropy"", ""max_depth"": 25, ""max_features"": ""log2"", ""min_samples_leaf"": 3, ""min_samples_split"": 48, ""n_estimators"": 920}",COMPLETE
15,0.264038807694653,2026-09-19 04:02:57.681074,2026-09-19 04:03:00.292850,0 days 00:00:02.611776,gini,22,log2,1,46,875,"{""criterion"": ""gini"", ""max_depth"": 22, ""max_features"": ""log2"", ""min_samples_leaf"": 1, ""min_samples_split"": 46, ""n_estimators"": 875}",PRUNED
16,0.25930774451112504,2026-09-19 04:03:00.292850,2026-09-19 04:03:02.693045,0 days 00:00:02.400195,entropy,14,log2,9,46,878,"{""criterion"": ""entropy"", ""max_depth"": 14, ""max_features"": ""log2"", ""min_samples_leaf"": 9, ""min_samples_split"": 46, ""n_estimators"": 878}",PRUNED
17,0.2404482329404387,2026-09-19 04:03:02.693045,2026-09-19 04:03:11.698350,0 days 00:00:09.005305,entropy,15,0.5,1,47,883,"{""criterion"": ""entropy"", ""max_depth"": 15, ""max_features"": 0.5, ""min_samples_leaf"": 1, ""min_samples_split"": 47, ""n_estimators"": 883}",PRUNED
18,0.2526554129968558,2026-09-19 04:03:11.698350,2026-09-19 04:03:19.851244,0 days 00:00:08.152894,entropy,21,log2,4,44,566,"{""criterion"": ""entropy"", ""max_depth"": 21, ""max_features"": ""log2"", ""min_samples_leaf"": 4, ""min_samples_split"": 44, ""n_estimators"": 566}",COMPLETE
19,0.2527966770537751,2026-09-19 04:03:19.851244,2026-09-19 04:03:28.349602,0 days 00:00:08.498358,entropy,17,log2,5,47,606,"{""criterion"": ""entropy"", ""max_depth"": 17, ""max_features"": ""log2"", ""min_samples_leaf"": 5, ""min_samples_split"": 47, ""n_estimators"": 606}",COMPLETE
20,0.2675719090458972,2026-09-19 04:03:28.349602,2026-09-19 04:03:30.161651,0 days 00:00:01.812049,entropy,16,log2,7,46,683,"{""criterion"": ""entropy"", ""max_depth"": 16, ""max_features"": ""log2"", ""min_samples_leaf"": 7, ""min_samples_split"": 46, ""n_estimators"": 683}",PRUNED
21,0.2519246253606826,2026-09-19 04:03:30.161651,2026-09-19 04:03:37.980833,0 days 00:00:07.819182,entropy,20,log2,4,39,578,"{""criterion"": ""entropy"", ""max_depth"": 20, ""max_features"": ""log2"", ""min_samples_leaf"": 4, ""min_samples_split"": 39, ""n_estimators"": 578}",COMPLETE
22,0.271419244380682,2026-09-19 04:03:37.980833,2026-09-19 04:03:39.332614,0 days 00:00:01.351781,entropy,24,log2,8,39,478,"{""criterion"": ""entropy"", ""max_depth"": 24, ""max_features"": ""log2"", ""min_samples_leaf"": 8, ""min_samples_split"": 39, ""n_estimators"": 478}",PRUNED
23,0.24716828399301116,2026-09-19 04:03:39.332614,2026-09-19 04:03:46.125894,0 days 00:00:06.793280,entropy,23,log2,5,50,472,"{""criterion"": ""entropy"", ""max_depth"": 23, ""max_features"": ""log2"", ""min_samples_leaf"": 5, ""min_samples_split"": 50, ""n_estimators"": 472}",COMPLETE
24,0.2529323334338958,2026-09-19 04:03:46.125894,2026-09-19 04:03:58.177830,0 days 00:00:12.051936,entropy,25,log2,3,47,889,"{""criterion"": ""entropy"", ""max_depth"": 25, ""max_features"": ""log2"", ""min_samples_leaf"": 3, ""min_samples_split"": 47, ""n_estimators"": 889}",COMPLETE
25,0.2529246853004777,2026-09-19 04:03:58.177830,2026-09-19 04:04:07.024762,0 days 00:00:08.846932,entropy,24,log2,1,48,626,"{""criterion"": ""entropy"", ""max_depth"": 24, ""max_features"": ""log2"", ""min_samples_leaf"": 1, ""min_samples_split"": 48, ""n_estimators"": 626}",COMPLETE
26,0.2407700019975768,2026-09-19 04:04:07.024762,2026-09-19 04:04:13.810208,0 days 00:00:06.785446,entropy,24,0.5,1,49,654,"{""criterion"": ""entropy"", ""max_depth"": 24, ""max_features"": 0.5, ""min_samples_leaf"": 1, ""min_samples_split"": 49, ""n_estimators"": 654}",PRUNED
27,0.2733910810030757,2026-09-19 04:04:13.810208,2026-09-19 04:04:16.309234,0 days 00:00:02.499026,entropy,19,log2,6,36,911,"{""criterion"": ""entropy"", ""max_depth"": 19, ""max_features"": ""log2"", ""min_samples_leaf"": 6, ""min_samples_split"": 36, ""n_estimators"": 911}",PRUNED
28,0.22954043852855877,2026-09-19 04:04:16.309234,2026-09-19 04:04:26.845842,0 days 00:00:10.536608,entropy,25,0.75,1,42,700,"{""criterion"": ""entropy"", ""max_depth"": 25, ""max_features"": 0.75, ""min_samples_leaf"": 1, ""min_samples_split"": 42, ""n_estimators"": 700}",PRUNED
29,0.2810313792590266,2026-09-19 04:04:26.845842,2026-09-19 04:04:29.120150,0 days 00:00:02.274308,entropy,22,log2,1,36,820,"{""criterion"": ""entropy"", ""max_depth"": 22, ""max_features"": ""log2"", ""min_samples_leaf"": 1, ""min_samples_split"": 36, ""n_estimators"": 820}",PRUNED
30,0.2654436244792521,2026-09-19 04:04:29.120150,2026-09-19 04:04:30.060408,0 days 00:00:00.940258,entropy,21,log2,1,44,254,"{""criterion"": ""entropy"", ""max_depth"": 21, ""max_features"": ""log2"", ""min_samples_leaf"": 1, ""min_samples_split"": 44, ""n_estimators"": 254}",PRUNED
31,0.2824672283299765,2026-09-19 04:04:30.060408,2026-09-19 04:04:32.517001,0 days 00:00:02.456593,entropy,23,log2,4,47,707,"{""criterion"": ""entropy"", ""max_depth"": 23, ""max_features"": ""log2"", ""min_samples_leaf"": 4, ""min_samples_split"": 47, ""n_estimators"": 707}",PRUNED
32,0.255482794104129,2026-09-19 04:04:32.517001,2026-09-19 04:04:41.899249,0 days 00:00:09.382248,entropy,16,log2,3,48,648,"{""criterion"": ""entropy"", ""max_depth"": 16, ""max_features"": ""log2"", ""min_samples_leaf"": 3, ""min_samples_split"": 48, ""n_estimators"": 648}",COMPLETE
33,0.2850933305874866,2026-09-19 04:04:41.899249,2026-09-19 04:04:43.558166,0 days 00:00:01.658917,entropy,15,log2,5,43,568,"{""criterion"": ""entropy"", ""max_depth"": 15, ""max_features"": ""log2"", ""min_samples_leaf"": 5, ""min_samples_split"": 43, ""n_estimators"": 568}",PRUNED
34,0.2809885326913071,2026-09-19 04:04:43.558166,2026-09-19 04:04:45.216329,0 days 00:00:01.658163,entropy,18,log2,1,49,598,"{""criterion"": ""entropy"", ""max_depth"": 18, ""max_features"": ""log2"", ""min_samples_leaf"": 1, ""min_samples_split"": 49, ""n_estimators"": 598}",PRUNED
35,0.25379144486714234,2026-09-19 04:04:45.216329,2026-09-19 04:04:50.703423,0 days 00:00:05.487094,entropy,14,log2,2,45,372,"{""criterion"": ""entropy"", ""max_depth"": 14, ""max_features"": ""log2"", ""min_samples_leaf"": 2, ""min_samples_split"": 45, ""n_estimators"": 372}",COMPLETE
36,0.28097199255479327,2026-09-19 04:04:50.703423,2026-09-19 04:04:52.634380,0 days 00:00:01.930957,entropy,15,log2,1,40,639,"{""criterion"": ""entropy"", ""max_depth"": 15, ""max_features"": ""log2"", ""min_samples_leaf"": 1, ""min_samples_split"": 40, ""n_estimators"": 639}",PRUNED
37,0.2614173286437973,2026-09-19 04:04:52.634380,2026-09-19 04:04:54.625106,0 days 00:00:01.990726,entropy,25,log2,7,47,792,"{""criterion"": ""entropy"", ""max_depth"": 25, ""max_features"": ""log2"", ""min_samples_leaf"": 7, ""min_samples_split"": 47, ""n_estimators"": 792}",PRUNED
38,0.28155580230820176,2026-09-19 04:04:54.625106,2026-09-19 04:04:55.640992,0 days 00:00:01.015886,entropy,12,log2,1,37,354,"{""criterion"": ""entropy"", ""max_depth"": 12, ""max_features"": ""log2"", ""min_samples_leaf"": 1, ""min_samples_split"": 37, ""n_estimators"": 354}",PRUNED
39,0.2828809279920656,2026-09-19 04:04:55.640992,2026-09-19 04:04:56.893263,0 days 00:00:01.252271,entropy,11,log2,1,41,472,"{""criterion"": ""entropy"", ""max_depth"": 11, ""max_features"": ""log2"", ""min_samples_leaf"": 1, ""min_samples_split"": 41, ""n_estimators"": 472}",PRUNED
40,0.2569542813394759,2026-09-19 04:04:56.893263,2026-09-19 04:05:01.324766,0 days 00:00:04.431503,entropy,11,log2,2,47,296,"{""criterion"": ""entropy"", ""max_depth"": 11, ""max_features"": ""log2"", ""min_samples_leaf"": 2, ""min_samples_split"": 47, ""n_estimators"": 296}",COMPLETE
41,0.28345410425577877,2026-09-19 04:05:01.324766,2026-09-19 04:05:03.366522,0 days 00:00:02.041756,entropy,15,log2,2,50,788,"{""criterion"": ""entropy"", ""max_depth"": 15, ""max_features"": ""log2"", ""min_samples_leaf"": 2, ""min_samples_split"": 50, ""n_estimators"": 788}",PRUNED
42,0.2865770076105488,2026-09-19 04:05:03.366522,2026-09-19 04:05:04.378786,0 days 00:00:01.012264,entropy,13,log2,5,40,380,"{""criterion"": ""entropy"", ""max_depth"": 13, ""max_features"": ""log2"", ""min_samples_leaf"": 5, ""min_samples_split"": 40, ""n_estimators"": 380}",PRUNED
43,0.2768864434687621,2026-09-19 04:05:04.378786,2026-09-19 04:05:05.210418,0 days 00:00:00.831632,entropy,7,log2,2,39,262,"{""criterion"": ""entropy"", ""max_depth"": 7, ""max_features"": ""log2"", ""min_samples_leaf"": 2, ""min_samples_split"": 39, ""n_estimators"": 262}",PRUNED
44,0.2592958926205765,2026-09-19 04:05:05.210418,2026-09-19 04:05:14.719187,0 days 00:00:09.508769,entropy,13,log2,2,48,671,"{""criterion"": ""entropy"", ""max_depth"": 13, ""max_features"": ""log2"", ""min_samples_leaf"": 2, ""min_samples_split"": 48, ""n_estimators"": 671}",COMPLETE
45,0.2709781977638526,2026-09-19 04:05:14.719187,2026-09-19 04:05:15.596669,0 days 00:00:00.877482,entropy,17,log2,3,44,200,"{""criterion"": ""entropy"", ""max_depth"": 17, ""max_features"": ""log2"", ""min_samples_leaf"": 3, ""min_samples_split"": 44, ""n_estimators"": 200}",PRUNED
46,0.24945351546355427,2026-09-19 04:05:15.596669,2026-09-19 04:05:21.970207,0 days 00:00:06.373538,entropy,15,log2,2,47,422,"{""criterion"": ""entropy"", ""max_depth"": 15, ""max_features"": ""log2"", ""min_samples_leaf"": 2, ""min_samples_split"": 47, ""n_estimators"": 422}",COMPLETE
47,0.2688712688235484,2026-09-19 04:05:21.970207,2026-09-19 04:05:23.758248,0 days 00:00:01.788041,entropy,11,log2,4,46,696,"{""criterion"": ""entropy"", ""max_depth"": 11, ""max_features"": ""log2"", ""min_samples_leaf"": 4, ""min_samples_split"": 46, ""n_estimators"": 696}",PRUNED
48,0.28591642081122504,2026-09-19 04:05:23.758248,2026-09-19 04:05:24.516936,0 days 00:00:00.758688,entropy,12,log2,2,47,279,"{""criterion"": ""entropy"", ""max_depth"": 12, ""max_features"": ""log2"", ""min_samples_leaf"": 2, ""min_samples_split"": 47, ""n_estimators"": 279}",PRUNED
49,0.2578096656019296,2026-09-19 04:05:24.516936,2026-09-19 04:05:32.761293,0 days 00:00:08.244357,entropy,12,log2,2,45,591,"{""criterion"": ""entropy"", ""max_depth"": 12, ""max_features"": ""log2"", ""min_samples_leaf"": 2, ""min_samples_split"": 45, ""n_estimators"": 591}",COMPLETE
50,0.2490677705767183,2026-09-19 04:05:32.761293,2026-09-19 04:05:44.681786,0 days 00:00:11.920493,entropy,14,log2,4,40,866,"{""criterion"": ""entropy"", ""max_depth"": 14, ""max_features"": ""log2"", ""min_samples_leaf"": 4, ""min_samples_split"": 40, ""n_estimators"": 866}",COMPLETE
51,0.25554362196299146,2026-09-19 04:05:44.681786,2026-09-19 04:05:56.344197,0 days 00:00:11.662411,entropy,10,log2,2,42,874,"{""criterion"": ""entropy"", ""max_depth"": 10, ""max_features"": ""log2"", ""min_samples_leaf"": 2, ""min_samples_split"": 42, ""n_estimators"": 874}",COMPLETE
52,0.27997013919414837,2026-09-19 04:05:56.344197,2026-09-19 04:05:57.516185,0 days 00:00:01.171988,entropy,13,log2,4,47,441,"{""criterion"": ""entropy"", ""max_depth"": 13, ""max_features"": ""log2"", ""min_samples_leaf"": 4, ""min_samples_split"": 47, ""n_estimators"": 441}",PRUNED
53,0.253660628236067,2026-09-19 04:05:57.516185,2026-09-19 04:06:06.837679,0 days 00:00:09.321494,entropy,17,log2,3,44,626,"{""criterion"": ""entropy"", ""max_depth"": 17, ""max_features"": ""log2"", ""min_samples_leaf"": 3, ""min_samples_split"": 44, ""n_estimators"": 626}",COMPLETE
54,0.27294423911500826,2026-09-19 04:06:06.838679,2026-09-19 04:06:07.538482,0 days 00:00:00.699803,entropy,12,log2,5,44,245,"{""criterion"": ""entropy"", ""max_depth"": 12, ""max_features"": ""log2"", ""min_samples_leaf"": 5, ""min_samples_split"": 44, ""n_estimators"": 245}",PRUNED
55,0.2758419004983458,2026-09-19 04:06:07.538482,2026-09-19 04:06:09.073983,0 days 00:00:01.535501,entropy,10,log2,4,43,610,"{""criterion"": ""entropy"", ""max_depth"": 10, ""max_features"": ""log2"", ""min_samples_leaf"": 4, ""min_samples_split"": 43, ""n_estimators"": 610}",PRUNED
56,0.25645587886023713,2026-09-19 04:06:09.073983,2026-09-19 04:06:17.680246,0 days 00:00:08.606263,entropy,10,log2,1,38,612,"{""criterion"": ""entropy"", ""max_depth"": 10, ""max_features"": ""log2"", ""min_samples_leaf"": 1, ""min_samples_split"": 38, ""n_estimators"": 612}",COMPLETE
57,0.28651475070229704,2026-09-19 04:06:17.680246,2026-09-19 04:06:20.020444,0 days 00:00:02.340198,entropy,10,log2,3,46,943,"{""criterion"": ""entropy"", ""max_depth"": 10, ""max_features"": ""log2"", ""min_samples_leaf"": 3, ""min_samples_split"": 46, ""n_estimators"": 943}",PRUNED
58,0.2528501880827661,2026-09-19 04:06:20.020444,2026-09-19 04:06:30.711840,0 days 00:00:10.691396,entropy,11,log2,3,50,790,"{""criterion"": ""entropy"", ""max_depth"": 11, ""max_features"": ""log2"", ""min_samples_leaf"": 3, ""min_samples_split"": 50, ""n_estimators"": 790}",COMPLETE
59,0.28567360418642823,2026-09-19 04:06:30.712345,2026-09-19 04:06:32.724056,0 days 00:00:02.011711,entropy,13,log2,4,45,785,"{""criterion"": ""entropy"", ""max_depth"": 13, ""max_features"": ""log2"", ""min_samples_leaf"": 4, ""min_samples_split"": 45, ""n_estimators"": 785}",PRUNED
60,0.25382434164604006,2026-09-19 04:06:32.724056,2026-09-19 04:06:41.684755,0 days 00:00:08.960699,entropy,13,log2,2,37,657,"{""criterion"": ""entropy"", ""max_depth"": 13, ""max_features"": ""log2"", ""min_samples_leaf"": 2, ""min_samples_split"": 37, ""n_estimators"": 657}",COMPLETE
61,0.28238934810897803,2026-09-19 04:06:41.685758,2026-09-19 04:06:43.114262,0 days 00:00:01.428504,entropy,9,log2,1,46,554,"{""criterion"": ""entropy"", ""max_depth"": 9, ""max_features"": ""log2"", ""min_samples_leaf"": 1, ""min_samples_split"": 46, ""n_estimators"": 554}",PRUNED
62,0.25520118646045853,2026-09-19 04:06:43.114262,2026-09-19 04:06:53.370432,0 days 00:00:10.256170,entropy,11,log2,1,40,750,"{""criterion"": ""entropy"", ""max_depth"": 11, ""max_features"": ""log2"", ""min_samples_leaf"": 1, ""min_samples_split"": 40, ""n_estimators"": 750}",COMPLETE
63,0.2521520266587147,2026-09-19 04:06:53.370432,2026-09-19 04:07:02.087858,0 days 00:00:08.717426,entropy,12,log2,3,50,649,"{""criterion"": ""entropy"", ""max_depth"": 12, ""max_features"": ""log2"", ""min_samples_leaf"": 3, ""min_samples_split"": 50, ""n_estimators"": 649}",COMPLETE
64,0.28145198671728444,2026-09-19 04:07:02.087858,2026-09-19 04:07:03.819476,0 days 00:00:01.731618,entropy,10,log2,1,40,620,"{""criterion"": ""entropy"", ""max_depth"": 10, ""max_features"": ""log2"", ""min_samples_leaf"": 1, ""min_samples_split"": 40, ""n_estimators"": 620}",PRUNED
65,0.2561517908580564,2026-09-19 04:07:03.819476,2026-09-19 04:07:15.289185,0 days 00:00:11.469709,entropy,11,log2,1,39,824,"{""criterion"": ""entropy"", ""max_depth"": 11, ""max_features"": ""log2"", ""min_samples_leaf"": 1, ""min_samples_split"": 39, ""n_estimators"": 824}",COMPLETE
66,0.2575632927941941,2026-09-19 04:07:15.289185,2026-09-19 04:07:27.108032,0 days 00:00:11.818847,entropy,12,log2,2,44,864,"{""criterion"": ""entropy"", ""max_depth"": 12, ""max_features"": ""log2"", ""min_samples_leaf"": 2, ""min_samples_split"": 44, ""n_estimators"": 864}",COMPLETE
67,0.2567689414297418,2026-09-19 04:07:27.108032,2026-09-19 04:07:38.326234,0 days 00:00:11.218202,entropy,8,log2,2,42,892,"{""criterion"": ""entropy"", ""max_depth"": 8, ""max_features"": ""log2"", ""min_samples_leaf"": 2, ""min_samples_split"": 42, ""n_estimators"": 892}",COMPLETE
68,0.28295951740937475,2026-09-19 04:07:38.326234,2026-09-19 04:07:40.487282,0 days 00:00:02.161048,entropy,7,log2,2,41,922,"{""criterion"": ""entropy"", ""max_depth"": 7, ""max_features"": ""log2"", ""min_samples_leaf"": 2, ""min_samples_split"": 41, ""n_estimators"": 922}",PRUNED
69,0.28590459491712505,2026-09-19 04:07:40.487282,2026-09-19 04:07:43.003731,0 days 00:00:02.516449,entropy,7,log2,4,45,904,"{""criterion"": ""entropy"", ""max_depth"": 7, ""max_features"": ""log2"", ""min_samples_leaf"": 4, ""min_samples_split"": 45, ""n_estimators"": 904}",PRUNED
70,0.2845410282748527,2026-09-19 04:07:43.003731,2026-09-19 04:07:45.309000,0 days 00:00:02.305269,entropy,8,log2,2,41,774,"{""criterion"": ""entropy"", ""max_depth"": 8, ""max_features"": ""log2"", ""min_samples_leaf"": 2, ""min_samples_split"": 41, ""n_estimators"": 774}",PRUNED
71,0.260658339564973,2026-09-19 04:07:45.309000,2026-09-19 04:07:54.787281,0 days 00:00:09.478281,entropy,11,log2,1,34,666,"{""criterion"": ""entropy"", ""max_depth"": 11, ""max_features"": ""log2"", ""min_samples_leaf"": 1, ""min_samples_split"": 34, ""n_estimators"": 666}",COMPLETE
72,0.2890112092019714,2026-09-19 04:07:54.787281,2026-09-19 04:07:56.802448,0 days 00:00:02.015167,entropy,12,log2,3,33,687,"{""criterion"": ""entropy"", ""max_depth"": 12, ""max_features"": ""log2"", ""min_samples_leaf"": 3, ""min_samples_split"": 33, ""n_estimators"": 687}",PRUNED
73,0.2541946263260131,2026-09-19 04:07:56.802448,2026-09-19 04:08:06.428575,0 days 00:00:09.626127,entropy,11,log2,2,43,698,"{""criterion"": ""entropy"", ""max_depth"": 11, ""max_features"": ""log2"", ""min_samples_leaf"": 2, ""min_samples_split"": 43, ""n_estimators"": 698}",COMPLETE
74,0.2749299716015277,2026-09-19 04:08:06.428575,2026-09-19 04:08:08.593042,0 days 00:00:02.164467,entropy,8,log2,4,40,874,"{""criterion"": ""entropy"", ""max_depth"": 8, ""max_features"": ""log2"", ""min_samples_leaf"": 4, ""min_samples_split"": 40, ""n_estimators"": 874}",PRUNED
75,0.25720312064542783,2026-09-19 04:08:08.593042,2026-09-19 04:08:17.452598,0 days 00:00:08.859556,entropy,9,log2,2,33,619,"{""criterion"": ""entropy"", ""max_depth"": 9, ""max_features"": ""log2"", ""min_samples_leaf"": 2, ""min_samples_split"": 33, ""n_estimators"": 619}",COMPLETE
76,0.2860437681870917,2026-09-19 04:08:17.452598,2026-09-19 04:08:19.917812,0 days 00:00:02.465214,entropy,13,log2,2,47,931,"{""criterion"": ""entropy"", ""max_depth"": 13, ""max_features"": ""log2"", ""min_samples_leaf"": 2, ""min_samples_split"": 47, ""n_estimators"": 931}",PRUNED
77,0.28070907907538656,2026-09-19 04:08:19.917812,2026-09-19 04:08:21.328537,0 days 00:00:01.410725,entropy,5,log2,2,35,673,"{""criterion"": ""entropy"", ""max_depth"": 5, ""max_features"": ""log2"", ""min_samples_leaf"": 2, ""min_samples_split"": 35, ""n_estimators"": 673}",PRUNED
78,0.28954636736062533,2026-09-19 04:08:21.328537,2026-09-19 04:08:23.208069,0 days 00:00:01.879532,entropy,10,log2,4,38,670,"{""criterion"": ""entropy"", ""max_depth"": 10, ""max_features"": ""log2"", ""min_samples_leaf"": 4, ""min_samples_split"": 38, ""n_estimators"": 670}",PRUNED
79,0.2865674423517671,2026-09-19 04:08:23.208069,2026-09-19 04:08:24.637339,0 days 00:00:01.429270,entropy,9,log2,1,39,550,"{""criterion"": ""entropy"", ""max_depth"": 9, ""max_features"": ""log2"", ""min_samples_leaf"": 1, ""min_samples_split"": 39, ""n_estimators"": 550}",PRUNED
80,0.28689657541832725,2026-09-19 04:08:24.637339,2026-09-19 04:08:26.680066,0 days 00:00:02.042727,entropy,14,log2,1,47,728,"{""criterion"": ""entropy"", ""max_depth"": 14, ""max_features"": ""log2"", ""min_samples_leaf"": 1, ""min_samples_split"": 47, ""n_estimators"": 728}",PRUNED
